title,createdAt,mergedAt,closedAt,reviewsCount,reviewDecision,reviewTimeHours,filesChanged,description,result
add cw tests for lambda Invocations and Errors metrics,2023-11-15T18:57:04Z,2023-11-20T14:11:46Z,2023-11-20T14:11:46Z,4,,115.245,2,900,Merged
Organize config list,2023-11-15T20:08:56Z,2023-11-15T21:15:35Z,2023-11-15T21:15:35Z,2,,1.1108333333333333,5,738,Merged
Add NodeJS 20 support for Lambda,2023-11-16T15:27:36Z,,2023-11-23T14:06:54Z,3,,166.655,4,555,Closed
fix: supported multi account for test kinesis forward chain,2023-11-16T17:03:13Z,2023-11-24T10:56:47Z,2023-11-24T10:56:47Z,1,,185.89277777777778,1,980,Merged
unpin opensearch-py,2023-11-17T12:16:59Z,2023-11-17T13:36:06Z,2023-11-17T13:36:06Z,1,,1.3186111111111112,1,627,Merged
"unpin botocore, update minimum version",2023-11-17T12:22:50Z,2023-11-22T10:47:52Z,2023-11-22T10:47:52Z,1,,118.41722222222222,1,869,Merged
Fix int exception for API GW,2023-11-17T13:24:24Z,2023-11-22T07:02:06Z,2023-11-22T07:02:06Z,5,,113.62833333333333,2,743,Merged
fix s3 skip presign for missing SignedHeaders and fix query string param to headers,2023-11-17T15:40:00Z,2023-11-20T10:22:19Z,2023-11-20T10:22:19Z,1,,66.70527777777778,5,1742,Merged
[SFN] Support for CF Definition fields,2023-11-17T16:22:03Z,2023-11-27T08:29:32Z,2023-11-27T08:29:32Z,1,,232.12472222222223,3,979,Merged
fix SNS publish across region exception,2023-11-17T17:15:29Z,2023-11-23T17:22:27Z,2023-11-23T17:22:27Z,2,,144.1161111111111,3,770,Merged
Fix max fifo_id len,2023-11-17T18:37:04Z,,2024-02-03T12:29:13Z,2,CHANGES_REQUESTED,1865.8691666666666,0,769,Closed
skip emitting events in SSM if not enabled,2023-11-17T21:08:43Z,2023-11-20T14:05:49Z,2023-11-20T14:05:49Z,1,,64.95166666666667,1,780,Merged
fix get_object_tagging should work on versioned buckets without providing an explicit VersionId,2023-11-17T23:23:54Z,2023-11-20T20:59:59Z,2023-11-20T20:59:59Z,3,,69.60138888888889,3,674,Merged
Support Java21 in Lambda,2023-11-18T04:11:31Z,,2023-11-23T14:19:05Z,2,CHANGES_REQUESTED,130.1261111111111,8,131,Closed
"Update ASF APIs, update stepfunction provider signature",2023-11-20T05:03:57Z,2023-11-20T10:51:07Z,2023-11-20T10:51:07Z,1,,5.786111111111111,9,1516,Merged
APIGW: Fix tests to run with non-default account ID,2023-11-20T13:44:41Z,2023-12-11T11:33:02Z,2023-12-11T11:33:02Z,3,,501.80583333333334,5,802,Merged
Introduce DNS_NAME_PATTERNS_TO_RESOLVE_UPSTREAM config,2023-11-20T15:33:15Z,2023-12-06T16:26:27Z,2023-12-06T16:26:27Z,1,,384.88666666666666,4,1707,Merged
Fix execution storage for new stepfunctions provider,2023-11-20T22:22:20Z,2023-11-21T11:33:11Z,2023-11-21T11:33:11Z,1,,13.180833333333334,1,1016,Merged
Add new lambda runtimes and more parity fixes,2023-11-20T22:54:24Z,2023-11-23T11:34:30Z,2023-11-23T11:34:30Z,5,,60.66833333333334,22,2784,Merged
Bump the docker-base-images group with 1 update,2023-11-20T23:25:45Z,2023-11-21T06:54:16Z,2023-11-21T06:54:16Z,1,,7.4752777777777775,1,2470,Merged
Fix StepFunctions execution date formatting,2023-11-21T10:29:04Z,2023-12-02T21:55:29Z,2023-12-02T21:55:29Z,2,,275.4402777777778,9,582,Merged
CW V2 Dashboard CRD operations,2023-11-21T13:49:00Z,2023-11-21T19:42:19Z,2023-11-21T19:42:19Z,2,APPROVED,5.8886111111111115,5,542,Merged
remove sqs-query from health endpoint,2023-11-22T15:36:12Z,2023-11-23T06:52:37Z,2023-11-23T06:52:37Z,1,,15.27361111111111,2,435,Merged
fix sqs multi-protocol handling and upgrade botocore,2023-11-22T17:05:02Z,2024-01-05T20:06:13Z,2024-01-05T20:06:13Z,16,,1059.0197222222223,58,5318,Merged
create s3 image and pipeline,2023-11-22T22:41:26Z,2023-11-28T17:53:01Z,2023-11-28T17:53:01Z,16,,139.19305555555556,26,2929,Merged
s3: fix test_put_bucket_logging_wrong_target for multi-account and region ,2023-11-23T07:32:46Z,2023-11-29T05:34:27Z,2023-11-29T05:34:27Z,4,,142.02805555555557,2,913,Merged
fix: support for non-homogeneous lists,2023-11-23T12:29:02Z,2023-11-23T16:29:26Z,2023-11-23T16:29:26Z,1,,4.006666666666667,3,968,Merged
CW v2 Tests and small improvements ,2023-11-23T18:09:50Z,2023-12-14T13:52:21Z,2023-12-14T13:52:21Z,6,APPROVED,499.7086111111111,4,1173,Merged
[SFN] Enhancements to V2 Interpreter,2023-11-24T07:35:29Z,2023-11-27T16:05:07Z,2023-11-27T16:05:07Z,1,,80.49388888888889,15,1452,Merged
Fix for double-slash uri request,2023-11-24T09:34:25Z,2023-11-29T09:35:15Z,2023-11-29T09:35:15Z,8,,120.01388888888889,4,856,Merged
Remove HEADER_LOCALSTACK_ACCOUNT_ID,2023-11-24T10:58:03Z,2023-11-28T07:15:20Z,2023-11-28T07:15:20Z,4,,92.28805555555556,18,756,Merged
fix get_raw_path with double slash prefix path for legacy v-host S3,2023-11-24T11:02:46Z,2023-11-24T14:16:36Z,2023-11-24T14:16:36Z,1,,3.2305555555555556,4,1048,Merged
Enable AppSync cloudformation resources,2023-11-24T14:10:32Z,2023-11-30T16:29:22Z,2023-11-30T16:29:22Z,1,,146.3138888888889,1,903,Merged
CFn: render ext providers with correct plugin namespace,2023-11-24T15:08:04Z,2023-11-24T16:49:48Z,2023-11-24T16:49:48Z,1,,1.6955555555555555,1,1156,Merged
[SFN] Fix optimised integrations clients leading to timeouts and retries ,2023-11-26T12:20:08Z,2023-11-27T16:06:13Z,2023-11-27T16:06:13Z,1,,27.768055555555556,1,931,Merged
[SFN] Context Object arguments in Intrinsic Functions,2023-11-26T14:34:10Z,2023-11-27T17:24:53Z,2023-11-27T17:24:53Z,1,,26.845277777777778,16,836,Merged
Update ASF APIs,2023-11-27T05:04:26Z,,2024-01-07T14:26:10Z,1,CHANGES_REQUESTED,993.3622222222223,16,1606,Closed
added util function for time,2023-11-27T10:12:21Z,2023-11-30T13:22:14Z,2023-11-30T13:22:14Z,1,,75.16472222222222,1,704,Merged
s3: add SourceBucketLocation for CrossLocationLoggingProhibitions exception,2023-11-27T11:29:22Z,2023-11-28T05:15:55Z,2023-11-28T05:15:55Z,1,,17.775833333333335,6,956,Merged
fix cloudwatch resource providers,2023-11-27T14:39:04Z,2023-11-27T18:22:20Z,2023-11-27T18:22:20Z,1,,3.721111111111111,6,553,Merged
Enable test for Fn::GetAZs and extend feature,2023-11-27T18:36:00Z,2023-11-29T20:26:45Z,2023-11-29T20:26:45Z,1,,49.84583333333333,4,368,Merged
fix AWS::SNS::Topic canonicalizing bool to str for Attributes,2023-11-27T19:33:11Z,2023-11-28T16:51:41Z,2023-11-28T16:51:41Z,2,,21.308333333333334,3,878,Merged
fix AWS::SQS::Queue update missing QueueArn and QueueUrl,2023-11-27T20:06:31Z,2023-12-04T19:10:56Z,2023-12-04T19:10:56Z,4,,167.07361111111112,1,1200,Merged
Bump the docker-base-images group with 1 update,2023-11-27T23:22:58Z,2023-11-28T06:51:04Z,2023-11-28T06:51:04Z,1,,7.468333333333334,1,2488,Merged
Support creation of CloudFormation stacks with the same name after deletion,2023-11-28T07:05:49Z,2023-12-01T18:53:17Z,2023-12-01T18:53:17Z,5,,83.7911111111111,7,1372,Merged
[SFN] Enhancements for Intrinsic Function StringSplit,2023-11-28T09:27:08Z,2023-11-28T16:05:09Z,2023-11-28T16:05:09Z,1,,6.633611111111111,5,903,Merged
"Remove thread-local region, access key and account ID",2023-11-28T09:36:54Z,2023-11-30T11:32:58Z,2023-11-30T11:32:58Z,1,,49.934444444444445,7,403,Merged
fix kms key creation for s3 encryption,2023-11-28T09:44:48Z,2023-11-30T06:59:49Z,2023-11-30T06:59:49Z,1,,45.250277777777775,2,956,Merged
Fix Lambda CloudWatch metric recording upon invocation error,2023-11-28T11:48:47Z,2023-11-29T08:30:32Z,2023-11-29T08:30:32Z,1,,20.695833333333333,4,1836,Merged
remove remaining (transitive) usages of Quart,2023-11-28T12:38:58Z,2024-06-06T10:13:10Z,2024-06-06T10:13:10Z,1,,4581.57,6,1736,Merged
remove deprecated HttpRequest type alias,2023-11-28T14:41:16Z,2024-06-08T09:02:08Z,2024-06-08T09:02:08Z,1,,4626.347777777778,8,1025,Merged
Update Lambda runtime test skip condition,2023-11-28T15:20:01Z,2023-12-01T13:22:07Z,2023-12-01T13:22:08Z,2,,70.035,1,1027,Merged
Add image sha to startup information and more details to bug report template,2023-11-28T17:30:20Z,2024-05-16T09:29:38Z,2024-05-16T09:29:38Z,3,,4071.9883333333332,2,753,Merged
Test lambda provisioned concurrency scheduling,2023-11-28T17:36:15Z,2023-11-29T09:10:36Z,2023-11-29T09:10:36Z,1,,15.5725,4,958,Merged
add APIGW PutIntegration IntegrationType validation,2023-11-28T18:35:29Z,2023-11-29T20:22:22Z,2023-11-29T20:22:22Z,2,,25.781388888888888,3,904,Merged
Spike: track resource management in tests,2023-11-28T21:44:04Z,,2024-06-07T11:41:28Z,1,,4597.956666666667,9,1586,Closed
fix type hints incompatible with python < 3.10 in aws_stack,2023-11-29T08:31:41Z,2023-11-29T10:31:24Z,2023-11-29T10:31:24Z,3,,1.9952777777777777,1,186,Merged
pin global awscli install in Dockerfile,2023-11-29T14:03:28Z,2023-11-29T15:17:37Z,2023-11-29T15:17:37Z,2,,1.2358333333333333,1,748,Merged
Add formatting-aware timestamp replacement via new TimestampTransformer,2023-11-29T18:04:49Z,2023-12-11T14:30:42Z,2023-12-11T14:30:42Z,2,,284.4313888888889,4,2112,Merged
add missing DeadLetterConfig parameter,2023-11-29T18:11:19Z,2023-12-04T15:03:47Z,2023-12-04T15:03:47Z,1,,116.87444444444445,4,780,Merged
Add AppConfig resource providers to CFn,2023-11-29T18:26:05Z,2023-12-22T17:55:51Z,2023-12-22T17:55:51Z,2,,551.4961111111111,1,236,Merged
Add option to capture raw snapshots when running tests,2023-11-29T19:36:42Z,2023-12-01T17:11:03Z,2023-12-01T17:11:03Z,2,,45.5725,4,594,Merged
enable Fn::Transform to use CFn macros,2023-11-29T20:21:51Z,2024-02-12T18:27:13Z,2024-02-12T18:27:13Z,3,,1798.0894444444446,7,812,Merged
"Fix missing ""Pulling container image"" message from CLI startup",2023-11-30T11:04:05Z,2023-12-04T13:24:28Z,2023-12-04T13:24:28Z,1,,98.33972222222222,3,1443,Merged
Add AWS::Athena::*  Resource Providers for CFn,2023-11-30T12:14:08Z,2023-12-22T17:54:36Z,2023-12-22T17:54:36Z,1,,533.6744444444445,1,101,Merged
[SFN] Fix string lexing in Intrinsic Function arguments,2023-11-30T20:27:13Z,2023-12-01T18:12:23Z,2023-12-01T18:12:23Z,1,,21.752777777777776,10,1144,Merged
events: add account_id while creating client in sending events to target,2023-12-01T06:51:49Z,2024-02-16T09:56:23Z,2024-02-16T09:56:23Z,6,,1851.076111111111,2,1614,Merged
fixed account id for firehose integration,2023-12-01T09:36:35Z,2023-12-04T17:35:07Z,2023-12-04T17:35:07Z,1,,79.97555555555556,5,1732,Merged
Add list to dictionary transformation function in provider_utils For CFn,2023-12-01T11:48:29Z,2023-12-01T12:57:17Z,2023-12-01T12:57:17Z,1,,1.1466666666666667,1,415,Merged
Cfn: Fix boto client not using credentials for Lambda PublishVersion,2023-12-01T12:28:11Z,2023-12-05T06:49:49Z,2023-12-05T06:49:49Z,1,,90.36055555555555,1,350,Merged
Fix alias resource records & add missing id in AWS::Route53::RecordSet,2023-12-01T12:49:58Z,2023-12-01T14:25:27Z,2023-12-01T14:25:27Z,1,,1.591388888888889,1,607,Merged
CFn: fix AWS::Events::Rule ref/id/name attributes,2023-12-01T14:54:05Z,2023-12-06T16:21:23Z,2023-12-06T16:21:23Z,1,,121.455,5,1339,Merged
add support for AWS::DynamoDB::GlobalTable resource type,2023-12-01T18:34:39Z,2023-12-08T13:26:01Z,2023-12-08T13:26:01Z,2,,162.85611111111112,7,252,Merged
Add option to disable AWS_ENDPOINT_URL,2023-12-04T08:44:32Z,2023-12-05T10:55:45Z,2023-12-05T10:55:45Z,3,,26.186944444444446,2,1584,Merged
Update boto3 stubs and types for our client factory,2023-12-04T13:46:53Z,2024-02-15T15:42:37Z,2024-02-15T15:42:37Z,2,,1753.9288888888889,6,261,Merged
fix recursive types when generating TypedDicts,2023-12-04T14:16:33Z,2023-12-04T16:40:43Z,2023-12-04T16:40:43Z,1,,2.4027777777777777,1,235,Merged
Improve lambda multiruntime tests,2023-12-04T14:46:00Z,2023-12-06T09:41:35Z,2023-12-06T09:41:35Z,4,,42.92638888888889,60,1425,Merged
fix: fix failing dashboard lifecycle test for multi-account and region,2023-12-04T17:54:24Z,2023-12-05T15:28:16Z,2023-12-05T15:28:16Z,1,,21.564444444444444,1,1084,Merged
"[SFN] Enhancements to States I/O, Support for null InputPath and OutputPath",2023-12-04T23:28:40Z,2023-12-06T08:26:27Z,2023-12-06T08:26:27Z,1,,32.963055555555556,49,1552,Merged
Bump the docker-base-images group with 2 updates,2023-12-04T23:29:29Z,2023-12-05T06:52:33Z,2023-12-05T06:52:33Z,1,,7.384444444444444,2,2257,Merged
fix: handle BucketAlreadyOwnedByYou exception when uploading lambda in scenario test cases ,2023-12-05T07:50:25Z,2023-12-06T15:31:06Z,2023-12-06T15:31:06Z,2,,31.678055555555556,6,1461,Merged
add cross-account for CopyObject,2023-12-05T14:41:08Z,2023-12-06T15:06:20Z,2023-12-06T15:06:21Z,1,,24.42,2,1088,Merged
Add support for AWS::CloudFront::* CFn Resources,2023-12-05T18:17:58Z,,2024-02-14T20:44:59Z,1,,1706.4502777777777,1,257,Closed
fix APIGW import integration method for AWS integration type,2023-12-05T20:34:14Z,2023-12-17T20:59:48Z,2023-12-17T20:59:48Z,1,,288.4261111111111,4,798,Merged
Fix parsing of StepFunction timestamps ,2023-12-06T08:00:47Z,2024-03-02T12:22:51Z,2024-03-02T12:22:51Z,1,,2092.367777777778,27,712,Merged
Add support for conditions on CFn stack outputs,2023-12-06T08:50:13Z,2023-12-06T14:09:19Z,2023-12-06T14:09:19Z,1,,5.318333333333333,5,314,Merged
Fix: lookup more specific DNS names directly,2023-12-06T15:10:35Z,2023-12-11T10:45:24Z,2023-12-11T10:45:24Z,1,,115.58027777777778,2,908,Merged
fix s3 presign tests for multi account support,2023-12-06T16:58:14Z,2023-12-11T07:38:54Z,2023-12-11T07:38:54Z,4,,110.67777777777778,3,1278,Merged
Fix serialization of content in raw snapshots,2023-12-07T10:39:48Z,2023-12-11T17:07:49Z,2023-12-11T17:07:49Z,1,,102.46694444444445,1,280,Merged
Simplify the official docker-compose.yml,2023-12-07T15:24:50Z,2023-12-15T15:22:11Z,2023-12-15T15:22:11Z,6,,191.95583333333335,2,2790,Merged
Fix lambda function name validation for CreateFunction,2023-12-08T12:08:40Z,2023-12-11T15:33:43Z,2023-12-11T15:33:43Z,2,,75.4175,4,1525,Merged
Prevent error message being shown with entrypoints command,2023-12-08T16:14:18Z,2023-12-11T10:00:12Z,2023-12-11T10:00:12Z,1,,65.765,1,1061,Merged
Fix AWS parity for SQS list queues with empty response,2023-12-08T16:26:20Z,2023-12-11T09:59:45Z,2023-12-11T09:59:45Z,1,,65.55694444444444,3,803,Merged
Fix SQS CFn updates with no change,2023-12-08T21:20:41Z,2023-12-12T15:16:21Z,2023-12-12T15:16:21Z,6,,89.92777777777778,5,1389,Merged
Implement basic status filter for StepFunctions list-executions,2023-12-10T16:07:37Z,2024-03-14T22:19:33Z,2024-03-14T22:19:33Z,9,,2286.198888888889,5,458,Merged
add twisted gateway server,2023-12-10T23:05:42Z,2024-03-07T12:11:18Z,2024-03-07T12:11:18Z,7,,2101.0933333333332,15,3415,Merged
Skip comment for entrypoints line,2023-12-11T10:58:28Z,2023-12-11T14:33:55Z,2023-12-11T14:33:55Z,1,,3.5908333333333333,1,886,Merged
fix: serverless failing multi-account/region tests,2023-12-11T11:46:34Z,2023-12-13T07:49:27Z,2023-12-13T07:49:27Z,2,,44.04805555555556,1,1889,Merged
Install websocket-client as it is no longer included with docker client,2023-12-11T12:17:00Z,2023-12-11T13:38:14Z,2023-12-11T13:38:14Z,1,,1.353888888888889,1,817,Merged
Add AWS::CloudTrail::Trail resource to CloudFormation,2023-12-11T18:52:23Z,,2024-02-14T15:59:04Z,1,,1557.111388888889,1,69,Closed
Bump the github-actions group with 1 update,2023-12-11T23:35:58Z,2023-12-12T13:35:04Z,2023-12-12T13:35:04Z,1,,13.985,6,9834,Merged
remove outdated documentation and improve the README files,2023-12-12T10:46:56Z,2023-12-12T14:13:10Z,2023-12-12T14:13:10Z,1,,3.437222222222222,6,127,Merged
Bump moto-ext to 4.2.11.post1,2023-12-12T11:11:20Z,2023-12-18T10:26:19Z,2023-12-18T10:26:19Z,4,,143.24972222222223,2,146,Merged
Add support for AWS::Cognito::* in CloudFormation,2023-12-12T12:56:38Z,2023-12-22T16:26:57Z,2023-12-22T16:26:57Z,1,,243.5052777777778,1,316,Merged
fix s3 key handling with trailing slash,2023-12-12T12:57:55Z,2023-12-12T21:22:03Z,2023-12-12T21:22:03Z,5,,8.402222222222223,3,849,Merged
Feat/cloudwatch v2 put composite alarm,2023-12-12T13:57:30Z,2023-12-14T16:38:58Z,2023-12-14T16:38:58Z,1,APPROVED,50.69111111111111,2,756,Merged
fix S3 lifecycle tags filter,2023-12-12T14:24:26Z,2023-12-13T13:53:52Z,2023-12-13T13:53:52Z,1,,23.490555555555556,3,765,Merged
Fix secret rotation in secretsmanager,2023-12-12T22:54:56Z,2024-01-02T13:22:12Z,2024-01-02T13:22:12Z,3,,494.45444444444445,4,1193,Merged
pin docker dependency to <7.0.0,2023-12-13T08:07:40Z,2023-12-13T09:09:56Z,2023-12-13T09:09:56Z,1,,1.0377777777777777,1,673,Merged
Updated Cloudformationn Schema to latest version,2023-12-13T09:04:30Z,2023-12-13T13:06:17Z,2023-12-13T13:06:17Z,1,,4.029722222222222,1,322,Merged
Add flag to disable kinesis-mock persistence,2023-12-14T10:58:58Z,2023-12-18T16:17:12Z,2023-12-18T16:17:12Z,1,,101.30388888888889,2,1210,Merged
Allow merging of config profiles,2023-12-14T15:01:03Z,2023-12-15T08:33:26Z,2023-12-15T08:33:26Z,1,,17.539722222222224,3,1416,Merged
fix S3 service name parsing consuming the stream,2023-12-14T15:09:38Z,2023-12-22T12:30:43Z,2023-12-22T12:30:43Z,3,,189.3513888888889,3,2102,Merged
add S3 object key validation,2023-12-14T18:32:37Z,2023-12-19T17:41:30Z,2023-12-19T17:41:30Z,1,,119.14805555555556,4,716,Merged
test get-metric-data with no unit,2023-12-15T08:31:36Z,2024-01-11T12:03:37Z,2024-01-11T12:03:37Z,2,APPROVED,651.5336111111111,3,2148,Merged
CloudWatch: Use SNS client with same region as topic,2023-12-15T10:19:40Z,2023-12-15T12:45:43Z,2023-12-15T12:45:43Z,1,,2.4341666666666666,1,492,Merged
Feat/cloudwatch v2 fix labels,2023-12-15T10:45:45Z,2023-12-15T12:37:14Z,2023-12-15T12:37:14Z,1,APPROVED,1.8580555555555556,3,962,Merged
Allow kinesis get_records shard iterator to have surrounding quotes,2023-12-15T15:30:41Z,2023-12-19T15:49:45Z,2023-12-19T15:49:45Z,3,,96.31777777777778,1,924,Merged
Fix: Route53 populating VPC fields,2023-12-15T15:46:49Z,2023-12-15T16:54:31Z,2023-12-15T16:54:31Z,1,,1.1283333333333334,3,1341,Merged
use batches to report SQS metrics for approximate query metrics,2023-12-15T16:48:52Z,2024-01-03T12:35:51Z,2024-01-03T12:35:51Z,3,,451.78305555555556,4,996,Merged
[SFN] Support for Optional ProcessorConfig Declarations,2023-12-15T21:38:14Z,2023-12-20T08:40:27Z,2023-12-20T08:40:27Z,1,,107.03694444444444,6,805,Merged
[SFN] Fix Parallel State Output Ordering,2023-12-15T22:23:11Z,2023-12-20T07:38:57Z,2023-12-20T07:38:57Z,1,,105.26277777777777,5,714,Merged
[SFN] Enhanced Support for Exception Handling in Parallel States,2023-12-16T21:17:36Z,2023-12-23T07:18:55Z,2023-12-23T07:18:55Z,2,,154.02194444444444,10,1378,Merged
remove code in state locator,2023-12-17T12:03:35Z,2023-12-19T08:18:09Z,2023-12-19T08:18:09Z,1,,44.242777777777775,2,869,Merged
Fix: ACM: Additional domains missing from subject alternative names summaries,2023-12-18T09:43:51Z,2023-12-22T12:57:34Z,2023-12-22T12:57:34Z,2,,99.2286111111111,3,922,Merged
Transcribe: Add support for transcribing video files,2023-12-18T11:07:11Z,2023-12-19T05:26:02Z,2023-12-19T05:26:02Z,3,,18.314166666666665,4,3447,Merged
Add link-local address and init args to Docker client API,2023-12-18T13:31:58Z,2024-01-04T05:55:58Z,2024-01-04T05:55:58Z,1,,400.4,4,402,Merged
fix S3 UploadPart logic when cancelling/error a request,2023-12-18T16:04:15Z,2023-12-19T15:40:25Z,2023-12-19T15:40:25Z,1,,23.602777777777778,2,2039,Merged
add reset feature to CW v2,2023-12-18T16:48:39Z,2023-12-19T19:27:44Z,2023-12-19T19:27:44Z,2,APPROVED,26.65138888888889,2,370,Merged
Added missing type conversion for CFn update of Lambda::Function MemorySize to int,2023-12-18T17:31:47Z,2023-12-19T17:17:15Z,2023-12-19T17:17:15Z,1,,23.75777777777778,1,448,Merged
add cli option to restart localstack container,2023-12-18T18:20:42Z,2023-12-27T16:57:22Z,2023-12-27T16:57:22Z,2,,214.61111111111111,2,146,Merged
Add custom physical resource ID for AWS::RDS::DBProxyTargetGroup,2023-12-18T19:50:45Z,2024-02-22T17:21:12Z,2024-02-22T17:21:12Z,1,,1581.5075,1,60,Merged
Bump Kinesis Mock to 0.4.5,2023-12-18T22:06:05Z,2023-12-19T14:05:30Z,2023-12-19T14:05:30Z,1,,15.990277777777777,1,665,Merged
Bump the docker-base-images group with 2 updates,2023-12-18T23:29:24Z,2023-12-19T08:57:04Z,2023-12-19T08:57:04Z,1,,9.46111111111111,2,2279,Merged
Update dynamodb snapshot to unblock pipeline,2023-12-19T08:45:02Z,2023-12-19T11:51:43Z,2023-12-19T11:51:43Z,2,,3.111388888888889,2,1172,Merged
Remove error message if environment does not exist,2023-12-19T15:12:03Z,2023-12-20T10:48:38Z,2023-12-20T10:48:38Z,1,,19.60972222222222,1,1141,Merged
fix CFN RequestValidator parameters being optional,2023-12-19T18:36:24Z,2023-12-21T23:21:25Z,2023-12-21T23:21:25Z,2,,52.750277777777775,4,1040,Merged
Test lambda performance and mitigate async invoke timeout error (#9917),2023-12-19T20:10:58Z,2023-12-22T20:06:42Z,2023-12-22T20:06:42Z,9,,71.92888888888889,10,6106,Merged
add more tests for cw v2,2023-12-19T21:49:47Z,2024-01-10T17:18:01Z,2024-01-10T17:18:01Z,8,APPROVED,523.4705555555555,4,608,Merged
[SFN] Implicit Reductions To and From botocore Types,2023-12-19T22:14:11Z,2024-01-10T17:39:54Z,2024-01-10T17:39:54Z,1,,523.4286111111111,13,1135,Merged
Refine get in touch readme,2023-12-19T22:56:49Z,2023-12-20T02:55:25Z,2023-12-20T02:55:25Z,1,,3.9766666666666666,1,787,Merged
Updates deduplication ID and group ID max length to 128,2023-12-20T11:49:30Z,2023-12-28T10:55:10Z,2023-12-28T10:55:10Z,4,,191.09444444444443,4,619,Merged
Fix: EventBus: match null value for anything-but rule,2023-12-21T12:44:29Z,2023-12-22T14:30:35Z,2023-12-22T14:30:35Z,1,,25.768333333333334,3,2073,Merged
Cfn: Fix nested stack name generation,2023-12-21T13:06:19Z,2023-12-29T08:25:33Z,2023-12-29T08:25:33Z,2,,187.32055555555556,3,940,Merged
Track date of last passed validation run of tests targeting AWS,2023-12-21T14:36:49Z,2023-12-21T20:29:03Z,2023-12-21T20:29:03Z,2,,5.870555555555556,4,1679,Merged
Add initial validation files for recorded snapshots,2023-12-21T20:41:28Z,2023-12-22T14:58:24Z,2023-12-22T14:58:25Z,3,,18.282222222222224,137,398,Merged
Fix prebuilding for lambda functions,2023-12-22T10:01:01Z,2024-01-25T17:19:59Z,2024-01-25T17:19:59Z,10,,823.3161111111111,4,548,Merged
Fix: EventBus: Exists prefix not considered for rule matching,2023-12-22T14:08:46Z,2023-12-29T12:40:20Z,2023-12-29T12:40:20Z,4,,166.5261111111111,4,2523,Merged
Add events method to docker clients,2023-12-22T15:10:03Z,2024-01-05T19:11:52Z,2024-01-05T19:11:52Z,2,,340.03027777777777,4,775,Merged
add opensearch 2.11,2023-12-23T17:17:24Z,2024-02-13T09:03:25Z,2024-02-13T09:03:25Z,7,,1239.7669444444443,7,81,Merged
Bump the docker-base-images group with 1 update,2023-12-25T23:04:17Z,2023-12-26T08:03:39Z,2023-12-26T08:03:39Z,1,,8.989444444444445,2,2533,Merged
Bump the github-actions group with 1 update,2023-12-25T23:49:31Z,2024-01-02T08:57:39Z,2024-01-02T08:57:39Z,1,,177.13555555555556,1,6150,Merged
[SFN] Support for JsonPath Regexes,2023-12-26T20:32:15Z,2024-02-19T14:29:42Z,2024-02-19T14:29:42Z,1,,1313.9575,21,1504,Merged
Revert recent changes to async lambda invoke (#9917),2023-12-27T08:02:27Z,2023-12-27T09:19:55Z,2023-12-27T09:19:55Z,2,,1.291111111111111,10,263,Merged
cloudwatch: fix functionality of metrics for multi-accounts and region,2023-12-27T08:41:29Z,2024-02-02T09:36:40Z,2024-02-02T09:36:40Z,2,,888.9197222222223,3,1318,Merged
[SFN] Support for Version Declarations,2023-12-27T17:57:33Z,2024-01-08T15:08:51Z,2024-01-08T15:08:51Z,1,,285.18833333333333,18,998,Merged
"Added SIGINT trap, improved docker workflow",2023-12-27T19:13:46Z,,2024-01-30T09:14:15Z,2,,806.0080555555555,1,253,Closed
Enable migrated SES resource providers,2023-12-27T19:59:57Z,2023-12-28T20:01:01Z,2023-12-28T20:01:01Z,1,,24.017777777777777,1,139,Merged
Add new client types to TypedServiceClientFactory,2023-12-28T19:29:06Z,2023-12-28T23:31:14Z,2023-12-28T23:31:14Z,1,,4.035555555555556,2,353,Merged
add SQS message retention period functionality,2023-12-28T23:59:26Z,2024-01-02T18:00:08Z,2024-01-02T18:00:08Z,2,,114.01166666666667,5,2340,Merged
refactor the status cli command,2023-12-29T10:28:46Z,,2023-12-29T14:04:26Z,1,CHANGES_REQUESTED,3.5944444444444446,2,863,Closed
add exception module to event source mappings,2023-12-30T17:23:20Z,2024-01-03T15:50:58Z,2024-01-03T15:50:58Z,2,,94.46055555555556,2,3177,Merged
add subrange operation for ports,2023-12-31T16:47:16Z,2024-01-03T14:18:07Z,2024-01-03T14:18:07Z,1,,69.51416666666667,2,915,Merged
Test lambda performance and mitigate async invoke timeout error v2,2024-01-02T15:01:50Z,2024-01-04T19:26:13Z,2024-01-04T19:26:13Z,4,,52.40638888888889,10,2224,Merged
fix sqs message group visibility when sending messages,2024-01-03T01:18:52Z,2024-01-03T12:34:09Z,2024-01-03T12:34:09Z,1,,11.254722222222222,3,1245,Merged
fix cloudwatch alarm evaluation for SampleCount,2024-01-03T12:34:00Z,2024-01-04T12:53:34Z,2024-01-04T12:53:34Z,2,,24.32611111111111,5,1004,Merged
fix SQS send batch message validation for message size,2024-01-03T16:22:38Z,2024-01-04T16:08:21Z,2024-01-04T16:08:21Z,1,,23.761944444444445,4,1251,Merged
fix S3 missing XML namespace,2024-01-03T17:07:46Z,2024-01-04T11:15:29Z,2024-01-04T11:15:29Z,1,,18.128611111111113,3,1066,Merged
snapshot test for return values on condition check failure,2024-01-03T17:56:18Z,2024-01-05T09:52:33Z,2024-01-05T09:52:33Z,1,,39.9375,3,1072,Merged
add lambda alarm action for cloudwatch,2024-01-03T18:47:34Z,2024-01-04T17:43:02Z,2024-01-04T17:43:02Z,1,,22.924444444444443,4,850,Merged
add SQS message move task feature,2024-01-04T00:33:49Z,2024-01-05T08:36:14Z,2024-01-05T08:36:14Z,11,,32.040277777777774,7,2482,Merged
fix CopySource unquoting of special + char,2024-01-04T13:55:44Z,2024-01-04T21:29:45Z,2024-01-04T21:29:46Z,3,,7.566944444444444,6,1555,Merged
fix snapshot match order,2024-01-04T14:43:00Z,2024-01-04T16:04:21Z,2024-01-04T16:04:21Z,1,,1.3558333333333332,1,940,Merged
fix lambda create event source mapping duplicates,2024-01-04T17:35:19Z,2024-01-05T10:39:56Z,2024-01-05T10:39:56Z,5,CHANGES_REQUESTED,17.076944444444443,11,1025,Merged
add SNS signing of messages,2024-01-04T18:46:28Z,2024-01-05T21:29:05Z,2024-01-05T21:29:05Z,2,,26.710277777777776,12,2969,Merged
improve S3 aws-chunked detection,2024-01-04T22:08:17Z,2024-01-05T12:42:57Z,2024-01-05T12:42:57Z,1,,14.577777777777778,2,1171,Merged
add OpenSearch analysis-kuromoji plugin,2024-01-05T13:07:32Z,2024-01-08T12:26:57Z,2024-01-08T12:26:57Z,1,,71.3236111111111,1,1096,Merged
add raw-metrics endpoint for v2,2024-01-05T14:46:01Z,2024-01-09T09:57:22Z,2024-01-09T09:57:22Z,2,APPROVED,91.18916666666667,3,1302,Merged
