title,createdAt,mergedAt,closedAt,reviewsCount,reviewDecision,reviewTimeHours,filesChanged,description,result
fix race condition in service plugin loading,2023-03-25T12:28:33Z,2023-03-25T15:32:06Z,2023-03-25T15:32:06Z,2,,3.0591666666666666,2,1865,Merged
rework init system that starts localstack,2023-03-26T22:16:15Z,2023-03-28T22:15:05Z,2023-03-28T22:15:05Z,2,,47.980555555555554,12,5975,Merged
small pipeline improvements,2023-03-27T14:00:22Z,2023-03-27T15:39:02Z,2023-03-27T15:39:02Z,1,,1.6444444444444444,5,1327,Merged
Add GATEWAY_LISTEN to analytics events,2023-03-27T14:18:57Z,2023-03-27T17:21:50Z,2023-03-27T17:21:50Z,1,,3.0480555555555555,1,257,Merged
Don't source (LOCALSTACK_)HOST in docker entrypoint,2023-03-27T14:48:09Z,2023-03-27T16:28:05Z,2023-03-27T16:28:05Z,1,,1.6655555555555555,1,264,Merged
add test for ListMultipartUploads,2023-03-27T17:52:21Z,2023-03-28T17:13:23Z,2023-03-28T17:13:23Z,1,,23.350555555555555,2,229,Merged
fix response structure for S3 ListMultipartUploads,2023-03-27T19:15:49Z,2023-03-29T12:43:51Z,2023-03-29T12:43:51Z,3,,41.46722222222222,5,678,Merged
Introduce new AWS client test fixtures,2023-03-27T19:31:34Z,2023-04-03T13:32:29Z,2023-04-03T13:32:29Z,9,,162.01527777777778,9,1268,Merged
add test for ListObjectsV2 + fix config flag,2023-03-28T11:08:30Z,2023-03-28T16:41:27Z,2023-03-28T16:41:27Z,3,,5.549166666666666,7,825,Merged
"Add utility for creating a client assuming a role, migrate some inter-service communication to new client",2023-03-28T16:54:22Z,2023-03-29T14:29:19Z,2023-03-29T14:29:19Z,3,,21.5825,11,1993,Merged
Integrate GATEWAY_LISTEN,2023-03-28T17:14:38Z,2023-08-14T13:11:15Z,2023-08-14T13:11:15Z,22,,3331.9436111111113,17,655,Merged
Improve Lambda deprecation warnings,2023-03-28T17:45:46Z,2023-03-29T07:28:52Z,2023-03-29T07:28:52Z,8,,13.718333333333334,10,607,Merged
fix flaky CLI tests after startup time improved,2023-03-29T08:22:15Z,2023-03-29T11:12:24Z,2023-03-29T11:12:24Z,1,,2.8358333333333334,1,1753,Merged
Support non-standard AWS regions,2023-03-29T08:55:53Z,2023-03-29T15:14:57Z,2023-03-29T15:14:57Z,4,,6.317777777777778,4,170,Merged
remove DISABLE_TERM_HANDLER in docker entrypoint,2023-03-29T09:22:06Z,2023-03-29T10:22:23Z,2023-03-29T10:22:23Z,1,,1.0047222222222223,1,261,Merged
Fix length check for CloudFormation TemplateBody,2023-03-29T11:52:46Z,2023-03-29T13:03:36Z,2023-03-29T13:03:36Z,1,,1.1805555555555556,1,429,Merged
cleanup coverage-docs scripts,2023-03-29T13:22:39Z,2023-03-31T11:51:44Z,2023-03-31T11:51:44Z,1,,46.484722222222224,4,359,Merged
Ignore publish version code hash if hot-reloading is active,2023-03-29T14:46:04Z,2023-03-29T16:50:26Z,2023-03-29T16:50:26Z,1,,2.0727777777777776,3,513,Merged
create separate cache directory for cli,2023-03-29T14:50:07Z,2023-03-29T16:19:30Z,2023-03-29T16:19:30Z,1,,1.4897222222222222,2,666,Merged
Add basic cloudwatch metrics for new lambda provider,2023-03-29T16:16:43Z,2023-03-29T20:54:41Z,2023-03-29T20:54:41Z,1,,4.632777777777778,2,613,Merged
fix signal handling in localstack-supervisor,2023-03-29T16:18:16Z,2023-03-29T18:10:07Z,2023-03-29T18:10:07Z,1,,1.8641666666666667,2,505,Merged
Limit retries when trying to start new lambda environments,2023-03-29T16:51:14Z,,2023-06-13T12:03:51Z,1,,1819.2102777777777,1,493,Closed
Log reported runtime init error,2023-03-29T20:08:02Z,2023-03-29T22:30:19Z,2023-03-29T22:30:19Z,1,,2.3713888888888888,2,116,Merged
Remove unneeded defaults for envars,2023-03-30T08:36:51Z,2023-03-30T09:50:33Z,2023-03-30T09:50:33Z,1,,1.2283333333333333,1,208,Merged
Add config option to override used lambda init version,2023-03-30T10:54:42Z,2023-03-30T18:14:26Z,2023-03-30T18:14:26Z,2,,7.328888888888889,2,463,Merged
fix GetObjectTagging and GetBucketTagging format,2023-03-30T20:06:26Z,2023-03-31T11:16:55Z,2023-03-31T11:16:56Z,1,,15.174722222222222,4,602,Merged
Refactor integration tests to use new client fixtures,2023-03-30T21:16:22Z,2023-04-03T18:14:05Z,2023-04-03T18:14:06Z,2,,92.96194444444444,101,491,Merged
Cleanup after non-standard region tests,2023-03-31T10:23:25Z,2023-04-01T12:45:56Z,2023-04-01T12:45:56Z,2,,26.37527777777778,1,1590,Merged
fix SNS Subscription Filter OR/AND combination on MessageBody,2023-03-31T15:52:28Z,2023-03-31T17:42:27Z,2023-03-31T17:42:27Z,1,,1.8330555555555557,4,310,Merged
fix SNS FIFO DLQ + add SequenceNumber to FIFO,2023-03-31T18:28:33Z,2023-04-02T18:39:58Z,2023-04-02T18:39:58Z,1,,48.19027777777778,5,734,Merged
small fixture fix,2023-03-31T20:29:53Z,2023-03-31T22:43:41Z,2023-03-31T22:43:41Z,1,,2.23,1,84,Merged
Rename CreateMultipartUploadOutput to InitiateMultipartUploadResult,2023-03-31T20:49:41Z,,2023-04-01T22:08:43Z,1,,25.317222222222224,2,257,Closed
[SFN] Failure support for aws-sdk,2023-03-31T23:42:39Z,2023-05-02T05:24:46Z,2023-05-02T05:24:46Z,1,,749.7019444444444,36,415,Merged
fix S3 response xml root tag names,2023-04-01T15:50:00Z,2023-04-03T09:03:18Z,2023-04-03T09:03:18Z,2,,41.221666666666664,4,5248,Merged
Fix AttributeError for custom S3 handler,2023-04-01T21:53:41Z,2023-04-02T01:05:22Z,2023-04-02T01:05:22Z,1,,3.194722222222222,1,444,Merged
add support for asgi lifespan protocol listener in asgi/wsgi bridge,2023-04-02T17:45:10Z,2023-04-03T16:47:08Z,2023-04-03T16:47:09Z,1,APPROVED,23.032777777777778,4,611,Merged
Update ASF APIs,2023-04-03T05:04:47Z,2023-04-03T06:49:17Z,2023-04-03T06:49:17Z,1,,1.7416666666666667,1,1435,Merged
set 'trylast' for pytest-teardown that writes the collected metrics,2023-04-03T09:17:45Z,2023-04-04T07:33:13Z,2023-04-04T07:33:13Z,1,,22.25777777777778,1,745,Merged
KMS HMAC support,2023-04-03T09:44:36Z,2023-04-04T17:08:10Z,2023-04-04T17:08:10Z,5,,31.392777777777777,4,194,Merged
include link to service coverage page on not implemented error,2023-04-03T17:40:12Z,2023-04-05T11:13:35Z,2023-04-05T11:13:35Z,2,,41.55638888888889,7,579,Merged
add SNS validation of JSON fields type for MessageStructure json,2023-04-03T19:57:16Z,2023-04-04T17:58:24Z,2023-04-04T17:58:24Z,1,,22.01888888888889,3,557,Merged
Move test client creation logic into util package for re-use across repos,2023-04-03T20:14:25Z,2023-04-04T05:57:37Z,2023-04-04T05:57:37Z,1,,9.72,4,288,Merged
Display custom error message for NotImplementedErrors,2023-04-03T22:55:10Z,2023-04-05T13:24:42Z,2023-04-05T13:24:42Z,4,,38.492222222222225,6,17,Merged
Transcribe: Return TranscriptionJob in StartTranscriptionJob response,2023-04-04T07:06:56Z,2023-04-04T08:22:27Z,2023-04-04T08:22:27Z,1,,1.2586111111111111,2,58,Merged
add quality gate for entrypoints to make targets,2023-04-04T08:40:36Z,2023-04-05T07:06:13Z,2023-04-05T07:06:13Z,1,,22.426944444444445,1,263,Merged
Add missing client types for TypedServiceClientFactory,2023-04-04T09:37:36Z,2023-04-04T11:19:57Z,2023-04-04T11:19:57Z,2,,1.7058333333333333,1,197,Merged
Update Lambda code owners,2023-04-04T12:09:22Z,2023-04-04T17:49:31Z,2023-04-04T17:49:31Z,2,,5.6691666666666665,1,61,Merged
add boto3-stubs to development deps,2023-04-04T12:27:38Z,,2023-04-05T09:15:49Z,3,,20.803055555555556,3,408,Closed
Disable HTTPS(S) proxies for internal calls,2023-04-04T14:56:09Z,2023-04-11T15:06:17Z,2023-04-11T15:06:17Z,5,,168.1688888888889,5,2876,Merged
switch from feature coverage to API coverage,2023-04-04T15:40:24Z,,2023-04-04T17:46:51Z,1,,2.1075,5,238,Closed
fix APIGW RestAPI minimumCompressionSize,2023-04-04T16:09:07Z,2023-04-04T17:46:43Z,2023-04-04T17:46:43Z,1,,1.6266666666666667,3,952,Merged
Remove old AWS client fixtures,2023-04-04T17:19:54Z,2023-04-09T04:42:36Z,2023-04-09T04:42:36Z,4,,107.37833333333333,22,121,Merged
Detect containerd containers,2023-04-04T21:35:39Z,2023-04-05T13:41:54Z,2023-04-05T13:41:54Z,2,,16.104166666666668,1,356,Merged
Cfn::IAM::Policy update,2023-04-05T06:29:12Z,2023-04-14T18:32:46Z,2023-04-14T18:32:46Z,1,,228.05944444444444,5,33,Merged
Add kms DeleteImportedKeyMaterial operation,2023-04-05T13:28:12Z,2023-04-06T10:49:04Z,2023-04-06T10:49:04Z,3,,21.34777777777778,4,679,Merged
add Docker SDK default timeout config,2023-04-06T08:18:29Z,2023-04-07T08:47:50Z,2023-04-07T08:47:50Z,1,,24.489166666666666,3,763,Merged
fix: KMS incorrect error messaging for invalid keys ,2023-04-06T09:03:45Z,2023-04-07T05:13:43Z,2023-04-07T05:13:43Z,2,,20.16611111111111,3,220,Merged
Update to Python 3.11,2023-04-06T09:57:00Z,2023-09-26T09:35:53Z,2023-09-26T09:35:53Z,1,,4151.648055555555,13,1474,Merged
fix CloudWatch logs describe-log-*,2023-04-06T10:07:26Z,2023-04-07T12:12:38Z,2023-04-07T12:12:38Z,2,,26.086666666666666,4,890,Merged
fix wrong service mapping to s3 vhost bucket,2023-04-06T17:30:58Z,2023-04-06T20:15:20Z,2023-04-06T20:15:20Z,1,,2.7394444444444446,2,1377,Merged
fix: add check on plaintext size to kms encrypt operation ,2023-04-07T06:15:39Z,2023-04-07T07:50:49Z,2023-04-07T07:50:49Z,1,,1.586111111111111,3,108,Merged
SQS: Add cross-account support,2023-04-07T09:48:36Z,2023-04-13T08:07:47Z,2023-04-13T08:07:47Z,5,APPROVED,142.31972222222223,6,134,Merged
"enforce semver labels, block major labeled PRs",2023-04-07T10:16:35Z,2023-05-03T12:00:01Z,2023-05-03T12:00:01Z,1,,625.7238888888888,10,882,Merged
fix invalid error message for decrypt with incorrect key,2023-04-07T10:19:37Z,2023-04-07T12:06:53Z,2023-04-07T12:06:53Z,1,,1.7877777777777777,3,218,Merged
simplify implementation of HTTPRequestEventStreamAdapter,2023-04-09T18:56:08Z,2023-04-19T18:13:23Z,2023-04-19T18:13:23Z,10,,239.2875,1,802,Merged
fix: Adding validation on kms plaintext based on the key type ,2023-04-09T23:55:05Z,,2023-04-11T12:11:12Z,4,CHANGES_REQUESTED,36.26861111111111,3,416,Closed
upgrade werkzeug to 2.2.3,2023-04-10T00:15:06Z,2023-04-21T14:15:08Z,2023-04-21T14:15:08Z,7,,278.00055555555554,14,2511,Merged
Update ASF APIs,2023-04-10T05:05:55Z,2023-04-11T10:52:50Z,2023-04-11T10:52:50Z,2,,29.781944444444445,3,1454,Merged
Fix server stop errors when restoring a snapshot,2023-04-10T15:09:42Z,2023-04-12T15:58:01Z,2023-04-12T15:58:01Z,1,,48.805277777777775,2,853,Merged
Replace SES Client In SNS Publisher,2023-04-10T17:49:48Z,2023-04-14T17:31:35Z,2023-04-14T17:31:35Z,1,,95.69638888888889,1,203,Merged
Fix containerd detection for host mode,2023-04-11T09:59:01Z,2023-04-11T15:57:13Z,2023-04-11T15:57:13Z,2,,5.97,1,725,Merged
fix: Adding validation on kms plaintext based on the key type,2023-04-11T12:21:14Z,2023-04-12T06:47:18Z,2023-04-12T06:47:18Z,1,,18.434444444444445,3,416,Merged
Use explicit region for test fixtures,2023-04-11T14:13:46Z,2023-04-27T14:13:56Z,2023-04-27T14:13:56Z,4,,384.0027777777778,3,301,Merged
Introduce usage counters,2023-04-11T16:42:03Z,2023-05-04T14:34:16Z,2023-05-04T14:34:16Z,8,,549.8702777777778,11,839,Merged
fix ASF operation signature mismatches,2023-04-12T08:36:06Z,2023-04-13T07:19:43Z,2023-04-13T07:19:43Z,1,,22.726944444444445,8,2491,Merged
Add transformers for KMS,2023-04-12T09:05:33Z,2023-04-13T12:38:28Z,2023-04-13T12:38:28Z,4,,27.54861111111111,3,118,Merged
Transcribe: Support output bucket name and output key,2023-04-12T09:39:54Z,,2023-06-05T07:57:28Z,1,,1294.2927777777777,1,58,Closed
remove infra analytics calls,2023-04-12T10:33:03Z,2023-04-13T15:30:30Z,2023-04-13T15:30:30Z,1,,28.9575,2,282,Merged
"Send service principal when assuming role, check if lambda can assume role before allowing creation",2023-04-12T15:17:06Z,2023-04-26T16:33:59Z,2023-04-26T16:33:59Z,2,,337.2813888888889,5,568,Merged
fix ConfirmSubscription access to SNS store,2023-04-13T03:38:12Z,2023-04-14T14:10:32Z,2023-04-14T14:10:32Z,6,,34.53888888888889,5,824,Merged
Bump moto-ext to 4.1.7.post1,2023-04-13T08:16:01Z,2023-04-17T09:58:34Z,2023-04-17T09:58:34Z,3,APPROVED,97.70916666666666,4,0,Merged
add github-envs for tinybird upload scripts,2023-04-13T08:26:49Z,2023-04-19T13:28:11Z,2023-04-19T13:28:11Z,1,,149.02277777777778,3,309,Merged
refactor pipeline testing community integration with pro,2023-04-13T09:29:43Z,2023-04-13T10:38:26Z,2023-04-13T10:38:26Z,1,,1.1452777777777778,2,1377,Merged
fix invalid access to thread-local access key ID,2023-04-13T10:11:57Z,2023-04-18T15:04:24Z,2023-04-18T15:04:24Z,2,,124.87416666666667,2,608,Merged
Add basic lambda performance tests,2023-04-13T12:41:58Z,2023-06-06T14:38:26Z,2023-06-06T14:38:26Z,1,,1297.941111111111,1,5425,Merged
Extract AWS Account ID from IAM access key ids (again),2023-04-13T14:20:21Z,2023-04-24T12:31:22Z,2023-04-24T12:31:22Z,4,,262.18361111111113,5,944,Merged
sns firehose client update,2023-04-14T17:33:55Z,2023-04-17T13:19:57Z,2023-04-17T13:19:57Z,1,,67.76722222222222,2,102,Merged
remove SNS create_sqs_message_attributes and add DLQ for Fifo topic,2023-04-14T18:12:27Z,2023-04-17T21:51:54Z,2023-04-17T21:51:54Z,1,,75.6575,4,845,Merged
SNS test and add deduplication for FIFO topic,2023-04-14T18:19:14Z,2023-04-19T10:38:00Z,2023-04-19T10:38:00Z,1,,112.31277777777778,3,514,Merged
SQS fix deduplication at queue level and deleted messages,2023-04-14T18:48:53Z,2023-04-18T19:32:31Z,2023-04-18T19:32:31Z,3,,96.72722222222222,4,700,Merged
fix IAM client fixture,2023-04-14T19:27:32Z,2023-04-14T20:32:03Z,2023-04-14T20:32:03Z,1,,1.0752777777777778,1,97,Merged
fix auto decoding of gzip for s3 vhost proxied requests,2023-04-14T21:16:03Z,2023-04-17T21:52:36Z,2023-04-17T21:52:36Z,1,,72.60916666666667,3,694,Merged
Always return bridge as fallback network,2023-04-17T09:53:36Z,2023-04-18T16:47:23Z,2023-04-18T16:47:23Z,1,,30.89638888888889,1,375,Merged
Bump moto-ext to 4.1.7.post2,2023-04-17T10:34:47Z,2023-04-18T08:47:12Z,2023-04-18T08:47:12Z,1,APPROVED,22.206944444444446,1,0,Merged
Fix lambda init xray telemetry initialization,2023-04-17T10:50:39Z,2023-04-18T06:46:46Z,2023-04-18T06:46:46Z,1,,19.935277777777777,3,371,Merged
[SFN] Failure support for lambda (service tasks),2023-04-18T11:52:07Z,2023-05-05T10:41:32Z,2023-05-05T10:41:32Z,1,,406.8236111111111,31,669,Merged
Fix firehose / s3 client creation of clients with role,2023-04-18T13:54:31Z,2023-04-19T12:18:33Z,2023-04-19T12:18:33Z,1,,22.400555555555556,4,342,Merged
fix default ProvisionedThroughput in DynamoDB,2023-04-18T15:51:35Z,2023-04-21T11:07:14Z,2023-04-21T11:07:14Z,1,,67.26083333333334,4,583,Merged
Add EC2 image ssm parameter type,2023-04-18T16:12:01Z,2023-04-19T10:59:25Z,2023-04-19T10:59:25Z,1,,18.79,1,211,Merged
Enhance parity for ACM certificates for wildcard subdomains,2023-04-18T17:15:34Z,2023-04-19T21:52:12Z,2023-04-19T21:52:12Z,5,,28.610555555555557,4,863,Merged
CFn: Implemented stack name validation,2023-04-19T07:35:04Z,2023-04-21T13:00:13Z,2023-04-21T13:00:13Z,1,,53.41916666666667,4,169,Merged
"add OpenSearch 2.5, remove Firehose limitation",2023-04-19T11:48:47Z,2023-04-21T07:22:51Z,2023-04-21T07:22:51Z,1,,43.56777777777778,6,676,Merged
fix CFn s3 CORS configuration for optional parameters,2023-04-20T18:25:58Z,2023-04-21T17:09:29Z,2023-04-21T17:09:29Z,1,,22.725277777777777,4,144,Merged
fix tag updates of AWS::SSM::Parameter,2023-04-21T07:59:23Z,2023-04-24T11:09:46Z,2023-04-24T11:09:46Z,3,,75.17305555555555,3,496,Merged
Fix publishing versions if package type is image,2023-04-21T10:06:22Z,2023-04-24T11:51:23Z,2023-04-24T11:51:24Z,5,,73.75027777777778,3,344,Merged
fix invalid SQS message decoding,2023-04-21T11:44:11Z,2023-04-21T12:49:47Z,2023-04-21T12:49:48Z,1,,1.0933333333333333,2,2557,Merged
"add support for python3.10 lambda runtime, now that it's officially a…",2023-04-23T17:47:30Z,2023-05-02T13:31:54Z,2023-05-02T13:31:54Z,8,,211.74,11,195,Merged
fix TypeError for get_ddb_provisioned_throughput,2023-04-24T12:21:24Z,2023-04-25T21:57:54Z,2023-04-25T21:57:54Z,1,,33.608333333333334,2,457,Merged
reintroduce vhost use in s3 cors tests,2023-04-24T16:06:30Z,2023-05-03T14:04:57Z,2023-05-03T14:04:57Z,1,,213.97416666666666,1,244,Merged
"re-install DynamoDB in Dockerfile, use cache for archive download",2023-04-25T13:03:14Z,2023-04-27T06:56:41Z,2023-04-27T06:56:42Z,2,,41.89083333333333,2,2512,Merged
Lambda: Implement cross-account access,2023-04-25T13:44:33Z,2023-05-15T06:06:31Z,2023-05-15T06:06:31Z,6,,472.36611111111114,3,2302,Merged
"Fix docker copy_to_container performance, especially on mac",2023-04-25T15:10:06Z,2023-04-26T16:16:57Z,2023-04-26T16:16:57Z,2,,25.114166666666666,2,910,Merged
fix: s3 parsing key with trailing backslash and reserved chars,2023-04-26T00:27:41Z,2023-04-26T19:12:19Z,2023-04-26T19:12:19Z,2,,18.74388888888889,2,134,Merged
upgrade Werkzeug to 2.3.4,2023-04-26T06:43:35Z,2023-05-09T11:01:58Z,2023-05-09T11:01:58Z,2,,316.3063888888889,7,4565,Merged
avoid Werkzeug and Flask upgrade to 2.3.0,2023-04-26T08:15:12Z,2023-04-26T09:25:08Z,2023-04-26T09:25:08Z,1,,1.1655555555555555,1,450,Merged
Use non-default formatted access key ID for tests,2023-04-26T13:05:56Z,,2024-04-08T13:05:56Z,2,,8352.0,3,2331,Closed
fix: Lambda integration with DDB binary items,2023-04-26T15:04:18Z,2023-05-26T07:57:35Z,2023-05-26T07:57:35Z,1,,712.8880555555555,3,222,Merged
add dynamodb utils to transform python values into DDB types,2023-04-26T17:17:08Z,2023-05-05T13:05:11Z,2023-05-05T13:05:11Z,1,,211.80083333333334,2,459,Merged
fix hardcoded user agent for APIGW lambda proxy test,2023-04-26T18:06:49Z,2023-04-27T06:34:25Z,2023-04-27T06:34:25Z,1,,12.46,2,486,Merged
"[SFN] Baseline support for SQS, fixes, enhancements, tests",2023-04-26T21:06:45Z,2023-05-07T19:36:03Z,2023-05-07T19:36:04Z,1,,262.48833333333334,35,401,Merged
mm: upgrade botocore and boto3,2023-04-27T06:26:11Z,2023-05-02T08:25:46Z,2023-05-02T08:25:46Z,22,,121.99305555555556,2,147,Merged
Fix mapping of denied access in docker hub,2023-04-27T14:17:58Z,2023-04-27T15:30:45Z,2023-04-27T15:30:45Z,1,,1.2130555555555556,2,2938,Merged
add s3 CopyObject tests,2023-04-27T15:23:29Z,2023-05-22T10:54:03Z,2023-05-22T10:54:03Z,1,,595.5094444444444,2,1120,Merged
Add SourceArn for Events Message Publisher,2023-04-27T19:42:58Z,2023-05-04T15:01:36Z,2023-05-04T15:01:36Z,2,,163.31055555555557,2,396,Merged
sqs: Clear depduplication cache when FifoQueue is cleared,2023-04-28T03:49:00Z,2023-05-10T15:30:16Z,2023-05-10T15:30:16Z,5,,299.6877777777778,2,59,Merged
Raise DependencyNotYetSatisfied instead of KeyError when secret is not yet populated,2023-04-28T08:26:08Z,2023-05-03T14:23:27Z,2023-05-03T14:23:27Z,1,,125.95527777777778,2,1016,Merged
SQS: Cross-account enhancements,2023-04-28T13:46:24Z,2023-06-21T08:58:53Z,2023-06-21T08:58:53Z,2,,1291.2080555555556,5,304,Merged
Add mediaconvert client type,2023-04-30T10:59:10Z,2023-05-03T14:03:20Z,2023-05-03T14:03:20Z,1,,75.06944444444444,1,0,Merged
Update ASF APIs,2023-05-01T05:05:06Z,2023-05-02T07:04:42Z,2023-05-02T07:04:42Z,2,,25.993333333333332,2,1445,Merged
Display a specified number of log lines on console based on tail option,2023-05-01T13:03:29Z,2023-05-08T16:46:37Z,2023-05-08T16:46:37Z,5,,171.7188888888889,2,13,Merged
Lambda: Cross-accounts enhancements,2023-05-02T07:05:12Z,2023-07-06T04:32:56Z,2023-07-06T04:32:56Z,2,,1557.4622222222222,4,148,Merged
Reduce stack usage in template_deployer,2023-05-02T12:53:44Z,2023-05-02T20:04:41Z,2023-05-02T20:04:41Z,3,,7.1825,6,431,Merged
Add support for Lambda java17 runtime,2023-05-02T16:15:54Z,2023-05-03T10:35:15Z,2023-05-03T10:35:15Z,4,,18.3225,9,596,Merged
fix message group id behavior in sqs fifo queues,2023-05-02T17:44:26Z,2023-05-09T08:29:29Z,2023-05-09T08:29:29Z,10,,158.75083333333333,6,5942,Merged
Move CFn utils and remove redundant code,2023-05-02T20:46:55Z,2023-05-03T13:02:41Z,2023-05-03T13:02:41Z,1,,16.262777777777778,4,268,Merged
CloudFormation: add types and restructure,2023-05-02T21:05:25Z,2023-05-04T17:22:09Z,2023-05-04T17:22:09Z,3,,44.278888888888886,2,349,Merged
Try to fix flaky http integration tests,2023-05-03T11:58:33Z,2023-05-03T13:07:20Z,2023-05-03T13:07:20Z,2,,1.146388888888889,2,2081,Merged
CFn: Allow tests to exit early,2023-05-03T14:33:01Z,,2023-05-03T15:55:41Z,2,,1.3777777777777778,2,472,Closed
"Refactor physical resource ID, Ref and GetAtt",2023-05-04T09:13:43Z,2023-05-12T19:49:30Z,2023-05-12T19:49:30Z,1,,202.5963888888889,24,406,Merged
KMS: implement cross-accounts access,2023-05-04T10:44:09Z,2023-05-10T11:53:27Z,2023-05-10T11:53:27Z,6,,145.155,5,1950,Merged
"fix stack set instance creation, add deletion",2023-05-04T12:55:44Z,2023-05-24T21:54:47Z,2023-05-24T21:54:47Z,1,,488.9841666666667,7,551,Merged
remove REF_*_ATTRS usage in models,2023-05-04T14:16:47Z,2023-05-09T09:02:17Z,2023-05-09T09:02:17Z,1,,114.75833333333334,6,0,Merged
chore: update lambda doc links,2023-05-04T14:48:35Z,2023-05-08T09:41:58Z,2023-05-08T09:41:58Z,1,,90.88972222222222,4,57,Merged
CFn: Shift ref resolution earlier,2023-05-04T18:52:00Z,2023-05-05T08:51:05Z,2023-05-05T08:51:05Z,1,,13.984722222222222,1,163,Merged
fix PutEvents non-existent custom EventBus,2023-05-05T09:01:49Z,2023-05-12T20:43:49Z,2023-05-12T20:43:49Z,2,,179.7,3,247,Merged
add feature for output s3 bucket and output key in start transcription ,2023-05-05T10:03:18Z,2023-05-09T14:27:22Z,2023-05-09T14:27:22Z,7,,100.4011111111111,4,352,Merged
CFn: remove physical resource id from some services,2023-05-05T10:16:47Z,2023-06-15T08:21:48Z,2023-06-15T08:21:48Z,4,,982.0836111111112,35,1238,Merged
fix SQS JSON protocol support in ASF,2023-05-05T13:20:32Z,2023-11-11T10:06:12Z,2023-11-11T10:06:12Z,3,,4556.761111111111,31,3310,Merged
add config to disable cloudwatch metrics for SQS,2023-05-05T14:33:19Z,2023-05-06T12:53:00Z,2023-05-06T12:53:00Z,1,,22.328055555555554,2,733,Merged
bump moto-ext to 4.1.8.post1,2023-05-05T15:39:55Z,2023-05-09T07:07:01Z,2023-05-09T07:07:01Z,2,,87.45166666666667,5,604,Merged
"Migrate s3 notifications to new clients, send test events",2023-05-08T12:48:56Z,2023-05-11T12:54:43Z,2023-05-11T12:54:43Z,1,,72.0963888888889,12,797,Merged
fix SdkDockerClient recovery if docker socket not available initially,2023-05-08T17:13:12Z,2023-05-09T09:45:16Z,2023-05-09T09:45:16Z,3,,16.534444444444443,3,602,Merged
fix GetBucketCORS if CORS does not exist in store,2023-05-08T20:03:11Z,2023-05-12T08:08:15Z,2023-05-12T08:08:15Z,1,,84.08444444444444,1,492,Merged
Remove REF_*_ATTRS from service models,2023-05-09T14:54:43Z,2023-05-10T05:33:43Z,2023-05-10T05:33:43Z,1,,14.65,1,89,Merged
update firehose client for eventbridge,2023-05-09T17:23:32Z,2023-05-12T13:40:55Z,2023-05-12T13:40:55Z,1,,68.28972222222222,2,71,Merged
Add same transcription job name case,2023-05-09T18:07:33Z,2023-05-10T06:54:20Z,2023-05-10T06:54:20Z,1,,12.779722222222222,3,86,Merged
Add more detail in cloudformation stack deploy failure,2023-05-09T21:01:40Z,2023-05-10T10:41:01Z,2023-05-10T10:41:01Z,1,,13.655833333333334,2,3326,Merged
add test for S3 LegalHold when targeting object version,2023-05-10T13:38:00Z,2023-05-22T12:33:24Z,2023-05-22T12:33:24Z,5,,286.92333333333335,2,166,Merged
[SFN] support for waitForTaskToken and enhancements,2023-05-10T14:03:37Z,2023-06-16T12:55:07Z,2023-06-16T12:55:08Z,2,,886.8583333333333,37,881,Merged
update kinesis client for events service,2023-05-10T19:25:53Z,2023-05-12T13:40:34Z,2023-05-12T13:40:34Z,1,,42.24472222222222,2,64,Merged
Fix loading of CloudFormation deploy UI HTML code,2023-05-11T07:58:35Z,2023-05-11T14:05:41Z,2023-05-11T14:05:41Z,2,,6.118333333333333,1,1586,Merged
DynamoDB: Remove extraneous call during region resolution,2023-05-11T11:40:55Z,2023-05-15T12:44:04Z,2023-05-15T12:44:04Z,1,,97.0525,2,9052,Merged
"Fix KeyId return value as ARN for ""generate_data_key*"" methods",2023-05-11T12:45:34Z,2023-05-11T16:37:41Z,2023-05-11T16:37:41Z,5,,3.868611111111111,3,665,Merged
"[SFN] support for lambda parameters, parameters abstractions",2023-05-11T13:41:42Z,2023-06-21T11:36:52Z,2023-06-21T11:36:52Z,2,,981.9194444444445,14,368,Merged
Add encryption context to encrypt and decrypt operations in KMS,2023-05-12T09:12:25Z,2023-05-16T07:28:58Z,2023-05-16T07:28:58Z,3,,94.27583333333334,6,355,Merged
remove install dependency on localstack_client,2023-05-12T09:46:19Z,2023-05-16T06:23:38Z,2023-05-16T06:23:38Z,7,,92.62194444444444,8,1322,Merged
add ClientRequestToken validation for SecretsManager,2023-05-12T10:14:42Z,2023-05-25T18:56:48Z,2023-05-25T18:56:48Z,2,,320.70166666666665,3,1291,Merged
CFn framework scaffolding,2023-05-12T16:39:44Z,,2023-06-13T15:11:15Z,6,,766.5252777777778,17,83,Closed
Fix issue publishing messages with String.Array attibutes,2023-05-12T17:38:20Z,2023-05-19T08:58:07Z,2023-05-19T08:58:07Z,2,,159.32972222222222,2,640,Merged
KMS: response key ID field must contain key ARN,2023-05-15T05:59:22Z,2023-05-22T06:16:39Z,2023-05-22T06:16:39Z,1,,168.28805555555556,1,266,Merged
Fix CFn model class & attribute lookup,2023-05-15T10:48:29Z,2023-05-15T18:03:03Z,2023-05-15T18:03:03Z,2,,7.2427777777777775,2,220,Merged
Integrate CloudTrail helper into LocalStack test fixtures,2023-05-15T16:22:32Z,2023-06-07T17:06:31Z,2023-06-07T17:06:31Z,3,,552.7330555555556,14,959,Merged
remove pin on botocore,2023-05-16T06:50:58Z,2023-05-17T11:35:30Z,2023-05-17T11:35:30Z,1,,28.74222222222222,3,1214,Merged
Refactor handling of CFn stack parameters,2023-05-16T08:44:04Z,2023-06-06T12:58:01Z,2023-06-06T12:58:01Z,2,,508.2325,14,987,Merged
[SFN] base support for DynamoDb,2023-05-17T06:16:10Z,2023-07-31T19:53:52Z,2023-07-31T19:53:52Z,1,,1813.6283333333333,25,360,Merged
bump moto to 4.1.9.post1,2023-05-17T12:10:20Z,2023-05-19T09:06:38Z,2023-05-19T09:06:38Z,1,,44.93833333333333,1,414,Merged
CFn: Add AWS::CloudFormation::WaitConditionHandle,2023-05-17T15:22:19Z,2023-05-17T19:45:06Z,2023-05-17T19:45:06Z,1,,4.379722222222222,6,393,Merged
fix ListBuckets tag order,2023-05-17T19:03:24Z,2023-05-18T12:54:57Z,2023-05-18T12:54:57Z,1,,17.859166666666667,3,2812,Merged
CFn: Stub WaitCondition resource,2023-05-18T10:13:52Z,2023-05-22T13:35:28Z,2023-05-22T13:35:28Z,1,,99.36,6,541,Merged
Fix extraction of container Image when using podman,2023-05-18T11:36:44Z,2023-05-18T20:36:26Z,2023-05-18T20:36:26Z,3,,8.995,4,1161,Merged
CFn: optional verbose errors,2023-05-18T19:56:15Z,2023-05-31T13:05:07Z,2023-05-31T13:05:07Z,1,,305.1477777777778,2,562,Merged
Add ddbstreams stores visit in DDB provider,2023-05-18T20:55:08Z,2023-05-19T13:19:45Z,2023-05-19T13:19:45Z,1,,16.41027777777778,2,171,Merged
SNS: Implement cross-account access,2023-05-19T10:07:16Z,2023-05-30T07:18:31Z,2023-05-30T07:18:32Z,4,,261.1875,3,329,Merged
