title,createdAt,mergedAt,closedAt,reviewsCount,reviewDecision,reviewTimeHours,filesChanged,description,result
improve SQS receipt handle error parity,2022-05-20T07:53:21Z,2022-05-20T17:59:13Z,2022-05-20T17:59:14Z,4,,10.097777777777777,2,1018,Merged
Use Moto account ID resolver,2022-05-20T09:21:05Z,2022-06-17T13:18:48Z,2022-06-17T13:18:48Z,8,CHANGES_REQUESTED,675.9619444444445,56,612,Merged
Slight refactoring to allow customizing DynamoDB server startup,2022-05-20T16:00:59Z,2022-05-21T15:29:05Z,2022-05-21T15:29:05Z,3,,23.468333333333334,1,845,Merged
Fix cfn apigw domain tags,2022-05-20T19:10:18Z,2022-05-26T20:40:30Z,2022-05-26T20:40:30Z,1,,145.50333333333333,3,279,Merged
Typo API Gateway Provider validateRequestPparameters,2022-05-21T01:09:52Z,2022-05-22T21:16:56Z,2022-05-22T21:16:56Z,3,,44.117777777777775,1,218,Merged
Introduce BackendStateLifecycle abstraction,2022-05-21T11:15:27Z,2022-05-27T18:45:48Z,2022-05-27T18:45:48Z,1,,151.50583333333333,2,657,Merged
fix create_queue to raise QueueAlreadyExists correctly,2022-05-22T18:01:57Z,2022-08-04T18:26:22Z,2022-08-04T18:26:22Z,3,,1776.4069444444444,3,469,Merged
fix SQS ReceiveMessage blocking behavior when MaxNumberOfMessages is set,2022-05-22T19:42:39Z,2022-05-22T21:15:14Z,2022-05-22T21:15:14Z,1,,1.5430555555555556,3,586,Merged
Add default UserName for AWS::IAM::User,2022-05-23T07:46:37Z,2022-05-23T10:51:28Z,2022-05-23T10:51:28Z,2,,3.0808333333333335,4,50,Merged
Use asyncio run_in_executor to prevent is_ssl_socket check from blocking,2022-05-23T09:57:20Z,2022-05-23T18:30:04Z,2022-05-23T18:30:05Z,2,,8.545555555555556,1,489,Merged
Add tests which verify EventBridge rules behavior,2022-05-23T10:19:04Z,2022-06-07T12:50:58Z,2022-06-07T12:50:59Z,3,,362.5316666666667,2,211,Merged
Add snapshot transformers,2022-05-23T16:05:58Z,2022-06-02T09:01:08Z,2022-06-02T09:01:09Z,8,,232.91944444444445,26,1614,Merged
Add hosts file to container to fix performance issues in windows container mode,2022-05-24T12:29:19Z,2022-05-24T14:30:37Z,2022-05-24T14:30:37Z,2,,2.0216666666666665,2,870,Merged
Additional arguments to start a DynamoDB server,2022-05-24T20:58:43Z,,2022-05-26T16:23:30Z,1,,43.41305555555556,1,0,Closed
add SQS feature flag to raise QueueDeletedRecently errors,2022-05-25T00:19:15Z,2022-05-28T00:30:34Z,2022-05-28T00:30:34Z,5,CHANGES_REQUESTED,72.18861111111111,3,634,Merged
Add test for catch/retry mechanism in StepFunctions,2022-05-25T16:55:00Z,2022-05-26T21:56:43Z,2022-05-26T21:56:43Z,1,,29.02861111111111,2,73,Merged
fix sqs query-api endpoint strategy routing,2022-05-25T17:08:59Z,2022-05-25T18:25:48Z,2022-05-25T18:25:48Z,2,,1.2802777777777778,3,602,Merged
Fix references to AWS managed policies in SAM templates,2022-05-25T20:51:07Z,2022-05-25T22:12:46Z,2022-05-25T22:12:46Z,1,,1.3608333333333333,4,841,Merged
TransactWriteItem for binary data,2022-05-26T17:11:24Z,2022-05-28T21:36:10Z,2022-05-28T21:36:11Z,2,,52.41277777777778,2,54,Merged
Bump moto-ext to version 3.1.10,2022-05-26T20:14:12Z,2022-05-27T18:45:05Z,2022-05-27T18:45:06Z,2,,22.514722222222222,5,34,Merged
test: invalidates #5395,2022-05-29T03:47:22Z,2022-06-05T07:04:12Z,2022-06-05T07:04:12Z,2,,171.28055555555557,1,52,Merged
Fix #5459 - a bug where DLQ fails to receive multiple failed messages,2022-05-29T08:12:54Z,,2022-08-10T15:37:04Z,1,,1759.4027777777778,3,105,Closed
Add CFn support for remaining EC2::Subnet properties,2022-05-29T12:42:09Z,2022-06-01T14:43:41Z,2022-06-01T14:43:41Z,3,,74.02555555555556,4,804,Merged
migrate Kinesis to ASF,2022-05-30T08:35:17Z,2022-08-30T14:16:27Z,2022-08-30T14:16:27Z,2,,2213.686111111111,23,2034,Merged
Cloud formation removal of unsupported and supported resources ,2022-05-30T09:07:58Z,2022-06-17T10:42:57Z,2022-06-17T10:42:57Z,5,,433.5830555555556,6,523,Merged
Fix SNS format when delivering to a DLQ,2022-05-30T11:35:16Z,2022-05-31T15:03:07Z,2022-05-31T15:03:08Z,9,,27.464166666666667,6,2468,Merged
Update redhat image to python 3.10,2022-05-30T13:31:42Z,2022-05-30T14:41:35Z,2022-05-30T14:41:35Z,1,,1.1647222222222222,1,712,Merged
APIGW Lambda integration validations,2022-05-30T20:56:47Z,2022-07-05T10:02:37Z,2022-07-05T10:02:37Z,4,,853.0972222222222,9,808,Merged
Added explicit check for a bucket when deploying a stack,2022-05-30T22:29:55Z,2022-06-01T16:24:03Z,2022-06-01T16:24:03Z,5,,41.90222222222222,2,412,Merged
add option to select test cases by fixture usage,2022-05-31T09:13:14Z,2022-05-31T11:06:02Z,2022-05-31T11:06:02Z,1,,1.88,2,114,Merged
Add error handling for localstack container startup in CLI,2022-05-31T14:38:44Z,2022-05-31T16:02:38Z,2022-05-31T16:02:38Z,1,,1.3983333333333334,2,397,Merged
Kinesis - option for persistence path,2022-05-31T23:08:36Z,2022-06-01T17:46:04Z,2022-06-01T17:46:04Z,2,,18.624444444444446,4,233,Merged
Test for IAM service linked role naming parity,2022-06-01T11:23:30Z,2022-06-13T09:25:04Z,2022-06-13T09:25:04Z,1,,286.0261111111111,2,312,Merged
fix apigateway delete_rest_api method,2022-06-01T19:48:57Z,2022-06-02T08:45:00Z,2022-06-02T08:45:00Z,1,,12.934166666666666,2,410,Merged
implement ExclusiveStartShardId for DynamoDB Streams describe_stream,2022-06-02T08:47:54Z,2022-06-03T18:57:25Z,2022-06-03T18:57:25Z,7,,34.158611111111114,4,1071,Merged
CFN Stack timestamps attributes,2022-06-02T23:06:04Z,2022-06-24T07:13:57Z,2022-06-24T07:13:57Z,2,,512.1313888888889,4,584,Merged
chore: remove chart release workflow,2022-06-03T07:36:19Z,2022-06-03T09:51:56Z,2022-06-03T09:51:56Z,1,,2.2602777777777776,1,84,Merged
switch to dev release versioning,2022-06-03T12:40:10Z,2022-06-03T14:06:56Z,2022-06-03T14:06:56Z,1,,1.4461111111111111,4,1491,Merged
Add `AWS::OpenSearchService::Domain`,2022-06-03T13:04:55Z,2022-06-07T10:39:47Z,2022-06-07T10:39:48Z,3,,93.58111111111111,5,268,Merged
Add temporary support for nodejs16.x runtime,2022-06-03T15:57:59Z,2022-06-29T13:46:01Z,2022-06-29T13:46:02Z,3,,621.8005555555555,7,357,Merged
fix log subscription: return id as string,2022-06-03T18:42:56Z,2022-06-07T12:43:45Z,2022-06-07T12:43:45Z,1,,90.01361111111112,6,267,Merged
fixed: route53 get-health-check response,2022-06-05T13:39:52Z,2022-06-06T21:01:24Z,2022-06-06T21:01:24Z,1,,31.358888888888888,1,130,Merged
fix domain name validation in opensearch CreateDomain operation,2022-06-05T19:38:23Z,2022-06-07T10:38:37Z,2022-06-07T10:38:37Z,1,,39.00388888888889,2,950,Merged
"Feature: Lambda Event Filtering for DynamoDB Streams, SQS",2022-06-06T13:41:37Z,2022-08-23T13:37:57Z,2022-08-23T13:37:57Z,11,CHANGES_REQUESTED,1871.9388888888889,9,1440,Merged
fix and clean up flaky cfn tests,2022-06-06T14:18:13Z,2022-06-06T22:52:01Z,2022-06-06T22:52:02Z,1,,8.563333333333333,2,229,Merged
fix concurrency of dynamodbstreams sequence number,2022-06-06T15:31:51Z,2022-06-06T22:57:00Z,2022-06-06T22:57:00Z,1,,7.4191666666666665,3,405,Merged
fix test_redrive_policy_http_subscription to correctly consume subscription notification,2022-06-06T18:07:39Z,2022-06-06T22:48:39Z,2022-06-06T22:48:40Z,1,,4.683333333333334,1,594,Merged
Add snapshot tests for s3 and cloudformation iam,2022-06-07T10:30:54Z,2022-06-10T16:30:23Z,2022-06-10T16:30:23Z,2,,77.99138888888889,13,114,Merged
fix op router for new HTTP gateway requests with slashes,2022-06-07T12:16:01Z,2022-06-07T15:11:34Z,2022-06-07T15:11:34Z,1,,2.9258333333333333,2,739,Merged
add .env to .gitignore,2022-06-08T12:15:21Z,2022-06-10T07:49:00Z,2022-06-10T07:49:00Z,1,,43.560833333333335,1,161,Merged
Fix SNS URL construction of ConfirmSubscription and Unsubscribe operation,2022-06-08T13:20:37Z,,2022-06-14T21:49:48Z,1,,152.48638888888888,2,516,Closed
remove itest-sqs-provider test from CI pipeline,2022-06-08T13:54:17Z,2022-06-08T16:33:30Z,2022-06-08T16:33:30Z,2,,2.653611111111111,1,181,Merged
Refactor Events test,2022-06-08T21:26:31Z,2022-07-05T10:10:37Z,2022-07-05T10:10:37Z,1,,636.735,1,123,Merged
add composite handler for asf handler chain,2022-06-08T22:22:00Z,2022-06-09T09:53:48Z,2022-06-09T09:53:48Z,1,,11.53,4,707,Merged
Removed duplicated SNSBackend,2022-06-09T14:54:04Z,2022-06-10T14:28:30Z,2022-06-10T14:28:30Z,1,,23.573888888888888,4,616,Merged
Exit pytest when encountering duplicate fixture names by default,2022-06-10T04:36:58Z,2022-06-10T10:11:14Z,2022-06-10T10:11:14Z,1,,5.571111111111111,4,347,Merged
fix ASF error serialization for shapes w/ members,2022-06-10T07:51:30Z,2022-07-20T10:56:03Z,2022-07-20T10:56:03Z,3,,963.0758333333333,37,808,Merged
chore: add localstack discussion page,2022-06-10T13:09:20Z,2022-06-11T13:10:52Z,2022-06-11T13:10:52Z,1,,24.025555555555556,3,84,Merged
refactor state serializer api to use werkzeug request,2022-06-10T16:59:22Z,2022-06-10T23:47:18Z,2022-06-10T23:47:18Z,1,,6.7988888888888885,1,67,Merged
add pluggable response handler for asf handler chain,2022-06-11T00:26:12Z,2022-06-11T13:07:43Z,2022-06-11T13:07:43Z,1,,12.691944444444445,4,277,Merged
Allow TCP proxying with client certs without h11,2022-06-11T13:12:44Z,2022-06-11T18:45:26Z,2022-06-11T18:45:26Z,1,,5.545,1,534,Merged
minor fix to include request parameters while importing openapi,2022-06-12T17:51:15Z,2022-06-12T20:54:47Z,2022-06-12T20:54:47Z,1,,3.0588888888888888,3,119,Merged
GCM support for SNS,2022-06-12T19:06:28Z,2022-06-22T08:58:06Z,2022-06-22T08:58:06Z,7,,229.86055555555555,2,493,Merged
Fix HTTP status for InvalidObjectState error code,2022-06-12T20:26:32Z,2022-06-14T18:57:35Z,2022-06-14T18:57:36Z,2,,46.5175,1,329,Merged
add support for apigateway lambda asynchronous invocations,2022-06-12T20:56:42Z,2022-06-24T06:53:19Z,2022-06-24T06:53:20Z,2,,273.9436111111111,7,915,Merged
Add filtering for names provided with name_query for GetApiKeys method,2022-06-13T12:35:50Z,2022-06-13T15:46:35Z,2022-06-13T15:46:35Z,1,,3.1791666666666667,2,316,Merged
Add handling of KMS ListAliases call with KeyId,2022-06-13T13:45:47Z,2022-06-23T13:04:07Z,2022-06-23T13:04:07Z,2,,239.30555555555554,4,134,Merged
Migrate labels to their new names,2022-06-13T15:55:37Z,2022-06-14T07:26:17Z,2022-06-14T07:26:17Z,1,,15.511111111111111,5,623,Merged
removed vpc association methods,2022-06-13T17:42:51Z,,2022-06-30T10:10:54Z,1,,400.4675,1,162,Closed
CI: Add a GHA to keep DockerHub description in sync,2022-06-13T18:13:53Z,2022-06-15T11:46:53Z,2022-06-15T11:46:53Z,3,,41.55,1,84,Merged
refactor API Gateway ASF provier / routing,2022-06-14T14:05:25Z,2022-06-14T15:11:57Z,2022-06-14T15:11:57Z,1,,1.1088888888888888,3,929,Merged
"Fix ConfirmSubscription in SNS http endpoint, match AWS behaviour",2022-06-14T21:49:40Z,2022-06-20T14:42:53Z,2022-06-20T14:42:54Z,5,,136.88694444444445,5,1956,Merged
periodically emit analytcs events containing aggregated HTTP response metrics,2022-06-14T21:55:14Z,2022-07-06T12:02:57Z,2022-07-06T12:02:57Z,9,APPROVED,518.1286111111111,16,508,Merged
Fix: auto confirm SNS subscription for lambda endpoint,2022-06-14T22:52:00Z,2022-06-15T11:41:29Z,2022-06-15T11:41:29Z,1,,12.824722222222222,2,606,Merged
Modify file ownership in localstack image to support Openshift deployments,2022-06-14T23:16:13Z,,2022-09-07T06:26:39Z,10,CHANGES_REQUESTED,2023.173888888889,1,3790,Closed
fix to skip openapi authorizers that are not extensions,2022-06-15T21:55:03Z,2022-06-23T11:35:09Z,2022-06-23T11:35:09Z,1,,181.66833333333332,1,177,Merged
fix mock integration invocations,2022-06-16T08:34:05Z,2022-06-22T18:27:49Z,2022-06-22T18:27:49Z,5,,153.89555555555555,5,243,Merged
CI: add paths and concurrency to pro integration workflow,2022-06-16T12:11:47Z,2022-06-19T11:09:50Z,2022-06-19T11:09:50Z,1,,70.9675,1,84,Merged
fix lambda integration output response,2022-06-17T10:51:34Z,2022-06-24T17:29:39Z,2022-06-24T17:29:39Z,3,,174.63472222222222,7,637,Merged
Improve parity of EncodingType and Delimiter in S3 list_objects response,2022-06-17T21:11:36Z,2022-06-18T23:19:11Z,2022-06-18T23:19:11Z,1,,26.12638888888889,3,373,Merged
Add HEALTHCHECK to Dockerfile,2022-06-18T15:54:52Z,2022-06-22T13:54:50Z,2022-06-22T13:54:50Z,4,,93.99944444444445,2,1814,Merged
update CODEOWNERS to make bentsku the SNS owner,2022-06-19T12:25:53Z,2022-06-20T10:40:41Z,2022-06-20T10:40:41Z,1,,22.246666666666666,1,67,Merged
remove node package.json and move node modules into static_libs dir,2022-06-19T16:32:24Z,2022-06-20T12:37:33Z,2022-06-20T12:37:33Z,1,,20.085833333333333,9,525,Merged
add new localstack filesystem hierarchy,2022-06-19T23:28:40Z,2022-06-28T16:38:20Z,2022-06-28T16:38:20Z,8,APPROVED,209.1611111111111,23,7494,Merged
collect parity metrics,2022-06-20T12:07:38Z,2022-07-11T17:15:53Z,2022-07-11T17:15:53Z,1,APPROVED,509.1375,13,863,Merged
fix detection of timestream requests in service router,2022-06-21T12:03:19Z,2022-06-21T20:35:31Z,2022-06-21T20:35:31Z,1,,8.536666666666667,2,1074,Merged
Accept string value for maxReceiveCount,2022-06-21T14:27:18Z,2022-06-22T14:56:43Z,2022-06-22T14:56:43Z,2,,24.490277777777777,2,706,Merged
Make hashable list/dict util classes immutable,2022-06-21T14:36:55Z,2022-06-22T14:02:22Z,2022-06-22T14:02:22Z,1,,23.424166666666668,4,546,Merged
Option for persistence path to stepfunctions,2022-06-21T21:01:20Z,2022-06-24T18:01:28Z,2022-06-24T18:01:28Z,2,,69.00222222222222,3,185,Merged
fix crypto unit tests,2022-06-22T09:22:19Z,2022-06-22T11:45:40Z,2022-06-22T11:45:40Z,1,,2.3891666666666667,2,394,Merged
add rds docdb and neptune to the list of known API conflicts,2022-06-22T10:59:20Z,2022-06-22T13:32:17Z,2022-06-22T13:32:17Z,2,,2.549166666666667,2,491,Merged
fix aws service router to match endpointPrefixes on the host,2022-06-22T11:04:25Z,2022-06-22T14:38:18Z,2022-06-22T14:38:18Z,1,,3.564722222222222,2,557,Merged
Default access key for legacy gateway,2022-06-22T14:20:32Z,2022-06-23T09:44:17Z,2022-06-23T09:44:18Z,2,APPROVED,19.395833333333332,1,2611,Merged
Bump moto-ext to 3.1.12,2022-06-22T14:44:58Z,2022-06-22T20:42:18Z,2022-06-22T20:42:18Z,1,,5.955555555555556,5,994,Merged
"Setting LS default user to root, support user permission boundary",2022-06-22T20:30:12Z,2022-07-08T09:02:22Z,2022-07-08T09:02:22Z,6,APPROVED,372.5361111111111,11,1181,Merged
Attach additional attributes to S3 bucket objects instead of using global dicts,2022-06-22T20:47:53Z,2022-06-23T09:19:59Z,2022-06-23T09:19:59Z,2,,12.535,4,1165,Merged
fix multi-registration of shared ASF API GW router,2022-06-23T07:32:35Z,2022-06-23T11:29:29Z,2022-06-23T11:29:29Z,1,,3.9483333333333333,1,451,Merged
Multi accounts feature flag,2022-06-23T09:29:12Z,2022-06-27T11:30:07Z,2022-06-27T11:30:07Z,1,APPROVED,98.01527777777778,3,108,Merged
Validate KMS tests and fix issues,2022-06-23T15:35:06Z,2022-07-08T13:18:45Z,2022-07-08T13:18:45Z,2,,357.7275,2,518,Merged
fix docker inspect health check log output,2022-06-24T07:56:09Z,2022-06-27T07:46:09Z,2022-06-27T07:46:09Z,1,,71.83333333333333,1,3808,Merged
GitHub action build matrix for CLI tests,2022-06-24T12:22:24Z,2022-06-24T14:21:50Z,2022-06-24T14:21:50Z,3,,1.9905555555555556,3,1132,Merged
Allow SES emails to be filterable by message ID,2022-06-24T13:02:11Z,2022-06-28T09:25:09Z,2022-06-28T09:25:10Z,2,,92.38277777777778,2,292,Merged
Feature: Lambda URL support,2022-06-24T22:49:43Z,2022-08-18T16:34:54Z,2022-08-18T16:34:54Z,12,CHANGES_REQUESTED,1313.7530555555556,11,231,Merged
fix asf apigateway lambda response conversion,2022-06-25T00:59:48Z,2022-06-25T10:56:23Z,2022-06-25T10:56:23Z,1,,9.943055555555556,3,861,Merged
fix S3 BackendState to raise ASF NoSuchBucket exception,2022-06-25T01:28:16Z,2022-06-25T14:13:11Z,2022-06-25T14:13:12Z,1,,12.748611111111112,2,243,Merged
fix passing down of use_ssl when starting edge,2022-06-25T02:14:38Z,2022-06-25T12:01:38Z,2022-06-25T12:01:38Z,1,,9.783333333333333,1,900,Merged
fix pickling in multi-account region backend,2022-06-25T03:18:09Z,2022-06-28T09:27:16Z,2022-06-28T09:27:16Z,1,APPROVED,78.15194444444444,1,1076,Merged
Refactored integration test,2022-06-25T07:08:20Z,2022-06-29T13:28:24Z,2022-06-29T13:28:24Z,1,,102.33444444444444,1,0,Merged
fix s3 delete_bucket compatibility with ASF gateway,2022-06-26T14:09:50Z,2022-06-26T21:12:27Z,2022-06-26T21:12:27Z,1,APPROVED,7.043611111111111,3,580,Merged
fix apigw LambdaResponse with async invocation to return empty body,2022-06-26T18:20:37Z,2022-06-26T21:12:56Z,2022-06-26T21:12:56Z,1,,2.8719444444444444,1,658,Merged
Add notification configuration id to event message,2022-06-27T09:10:41Z,2022-06-27T12:06:04Z,2022-06-27T12:06:04Z,1,,2.9230555555555555,1,361,Merged
fix ASF API GW / ASF HTTP gateway headers,2022-06-27T09:43:26Z,2022-06-27T11:23:47Z,2022-06-27T11:23:47Z,1,,1.6725,2,431,Merged
Add pip install to ensure latest dev releases are not overwritten,2022-06-28T08:49:07Z,2022-06-28T16:48:16Z,2022-06-28T16:48:16Z,2,,7.985833333333333,1,619,Merged
add convenience GitHub workflows for release branches,2022-06-28T13:49:30Z,2022-06-28T15:53:28Z,2022-06-28T15:53:28Z,2,,2.0661111111111112,3,3542,Merged
added support for firewall rule groups,2022-06-28T17:25:32Z,2022-07-05T21:05:40Z,2022-07-05T21:05:40Z,4,,171.6688888888889,8,1320,Merged
fix missing (rest-)json error type header field,2022-06-29T12:18:46Z,2022-07-01T18:03:48Z,2022-07-01T18:03:48Z,1,,53.75055555555556,3,1645,Merged
DynamoDB streaming binary content,2022-06-29T14:05:31Z,2022-07-04T15:04:04Z,2022-07-04T15:04:04Z,3,,120.97583333333333,5,316,Merged
Add test for ES6 export syntax with NodeJS runtimes in Lambda,2022-06-29T14:22:20Z,2022-06-29T20:29:31Z,2022-06-29T20:29:31Z,1,,6.119722222222222,3,0,Merged
fix SNS MessageAttributes parity with AWS,2022-06-29T15:08:31Z,2022-07-01T18:00:27Z,2022-07-01T18:00:27Z,1,,50.86555555555555,5,1483,Merged
defaults to None when attribute doesn't exist,2022-06-29T21:55:41Z,,2022-08-16T19:11:32Z,1,,1149.2641666666666,1,646,Closed
fix GitHub action user (use PAT of @localstack-bot),2022-06-30T08:17:43Z,2022-06-30T09:43:48Z,2022-06-30T09:43:48Z,1,,1.4347222222222222,3,841,Merged
Fix host path replacement for lambda volume mounts,2022-06-30T12:09:57Z,2022-06-30T20:47:13Z,2022-06-30T20:47:13Z,1,APPROVED,8.62111111111111,3,885,Merged
fix None check in AccountIdEnricher,2022-06-30T23:52:30Z,2022-07-01T16:38:58Z,2022-07-01T16:38:58Z,1,APPROVED,16.774444444444445,1,81,Merged
implement HTTP proxy framework,2022-07-01T00:29:54Z,2022-07-01T19:18:29Z,2022-07-01T19:18:29Z,5,APPROVED,18.809722222222224,8,3494,Merged
implement localstack python extensions framework,2022-07-01T01:10:07Z,2022-07-04T19:38:36Z,2022-07-04T19:38:36Z,3,APPROVED,90.47472222222223,23,1327,Merged
fix CI dep issues for newly introduced ext runtime deps,2022-07-01T08:43:06Z,2022-07-01T09:58:00Z,2022-07-01T09:58:00Z,2,,1.2483333333333333,1,1067,Merged
Minor fixes to mark DynamoDB test with binary data as aws_validated,2022-07-01T13:09:15Z,2022-07-01T17:14:15Z,2022-07-01T17:14:15Z,1,,4.083333333333333,3,940,Merged
Add fallback to default provider if configured provider is not available,2022-07-01T16:02:08Z,2022-07-05T09:38:52Z,2022-07-05T09:38:52Z,1,,89.61222222222223,1,646,Merged
terraform test execution in CI,2022-07-03T12:45:54Z,2022-07-05T17:00:59Z,2022-07-05T17:00:59Z,26,,52.25138888888889,5,50,Merged
add plugin installation for opensearch 1.1+,2022-07-04T07:44:10Z,2022-07-04T08:51:22Z,2022-07-04T08:51:22Z,1,,1.12,3,452,Merged
Support limiting ReservedConcurrentExecutions for Lambda invocations,2022-07-04T13:30:00Z,,2023-01-12T08:32:37Z,4,,4603.043611111111,8,604,Closed
Remove deprecated docker-compose defaults,2022-07-04T14:49:40Z,2022-07-04T19:55:48Z,2022-07-04T19:55:48Z,3,CHANGES_REQUESTED,5.102222222222222,2,660,Merged
update .dockerignore to new filesystem hierarchy,2022-07-05T00:02:40Z,2022-07-05T08:48:51Z,2022-07-05T08:48:51Z,1,APPROVED,8.769722222222223,2,578,Merged
add deprecation path for LEGACY_DIRECTORIES=1,2022-07-05T00:32:32Z,2022-07-05T19:49:59Z,2022-07-05T19:49:59Z,3,APPROVED,19.29083333333333,5,827,Merged
minor: Add test dependency to deepdiff,2022-07-05T07:21:33Z,2022-07-05T09:38:12Z,2022-07-05T09:38:12Z,1,,2.2775,1,237,Merged
fix cryptography updates / remove pin,2022-07-05T17:21:18Z,2022-07-05T19:51:26Z,2022-07-05T19:51:26Z,1,,2.502222222222222,1,518,Merged
"drop support for specific node, ruby & dotnet lambda runtime versions",2022-07-06T12:02:56Z,2022-07-06T18:25:37Z,2022-07-06T18:25:37Z,3,,6.378055555555555,3,576,Merged
add logs for lambda executor startup failure and removing containers on shutdown,2022-07-06T12:59:44Z,2022-07-07T10:46:53Z,2022-07-07T10:46:53Z,1,,21.785833333333333,2,347,Merged
add response parser to handler chain,2022-07-06T15:26:36Z,2022-07-07T09:55:04Z,2022-07-07T09:55:04Z,2,APPROVED,18.474444444444444,8,2777,Merged
Fixes #6405 Kms import key material ignores requested wrapping algo,2022-07-06T18:42:25Z,2022-07-13T09:02:38Z,2022-07-13T09:02:39Z,2,,158.33694444444444,1,88,Merged
Fix default content-type for APIGW-Lambda integration,2022-07-06T19:50:45Z,2022-07-08T08:11:11Z,2022-07-08T08:11:11Z,2,,36.340555555555554,3,191,Merged
add exception metadata to ASF generated ServiceException,2022-07-06T22:39:18Z,2022-07-07T09:15:31Z,2022-07-07T09:15:32Z,1,,10.60361111111111,31,398,Merged
fix lambda ASF API updates,2022-07-07T08:49:17Z,2022-07-07T11:40:36Z,2022-07-07T11:40:36Z,2,,2.855277777777778,6,1123,Merged
fix asgi header extraction for h11 and h2,2022-07-07T16:40:33Z,2022-07-07T17:57:52Z,2022-07-07T17:57:52Z,1,,1.2886111111111112,2,1196,Merged
fix parse_response to handle streaming responses,2022-07-07T19:11:49Z,2022-07-08T11:58:04Z,2022-07-08T11:58:04Z,3,APPROVED,16.770833333333332,3,928,Merged
Install sqlite native libs for DynamoDB on OSX arm64 (M1),2022-07-07T23:07:00Z,2022-07-08T09:30:47Z,2022-07-08T09:30:48Z,1,,10.39638888888889,4,514,Merged
fix(types): use typing,2022-07-08T14:25:33Z,,2022-07-11T10:30:41Z,2,,68.08555555555556,7,61,Closed
added support for route53resolver group association,2022-07-08T19:12:38Z,2022-07-18T07:39:10Z,2022-07-18T07:39:10Z,5,,228.44222222222223,5,876,Merged
add new log output formatting and asf trace logging,2022-07-09T00:08:31Z,2022-07-11T17:08:47Z,2022-07-11T17:08:48Z,2,APPROVED,65.00444444444445,14,1296,Merged
Feature: SNS msg delivery to Firehose endpoint,2022-07-10T22:51:46Z,2022-08-19T13:20:47Z,2022-08-19T13:20:47Z,4,,950.4836111111111,3,221,Merged
[6428] fix treating string as JSON array,2022-07-11T13:09:35Z,,2022-07-23T18:37:08Z,1,,293.45916666666665,1,18,Closed
set analytics api version to v1,2022-07-11T15:26:18Z,2022-07-11T17:09:48Z,2022-07-11T17:09:48Z,1,APPROVED,1.725,1,75,Merged
fix python 3.7 compat of setup_hypercorn_logger for cli,2022-07-11T19:54:12Z,2022-07-11T22:48:37Z,2022-07-11T22:48:37Z,1,,2.9069444444444446,1,2445,Merged
fix aws header list parsing,2022-07-12T11:37:12Z,2022-07-12T12:51:20Z,2022-07-12T12:51:20Z,1,,1.2355555555555555,3,2462,Merged
fix authorizer object for rest api,2022-07-12T15:23:34Z,2022-07-15T17:33:02Z,2022-07-15T17:33:02Z,1,,74.15777777777778,3,163,Merged
Make SERVICES act as preload-list for EAGER_SERVICE_LOADING,2022-07-12T16:23:30Z,2022-07-12T19:39:45Z,2022-07-12T19:39:45Z,1,,3.2708333333333335,9,1128,Merged
"remove `fix_return_consumed_capacity`, fixes #6437",2022-07-12T17:08:52Z,2022-07-15T13:55:49Z,2022-07-15T13:55:49Z,6,,68.7825,2,1155,Merged
Parity metrics report,2022-07-12T18:14:19Z,2022-08-02T13:59:32Z,2022-08-02T13:59:32Z,2,,499.7536111111111,5,252,Merged
Rework RegionBackend,2022-07-13T10:31:32Z,2022-07-22T08:20:03Z,2022-07-22T08:20:04Z,1,,213.8086111111111,2,1774,Merged
fix moto fallback dispatching on 404 errors,2022-07-13T13:04:58Z,2022-07-13T22:57:18Z,2022-07-13T22:57:18Z,1,,9.872222222222222,3,1387,Merged
"Remove python 3.6 compatibility mention from README, minor readme updates",2022-07-13T15:55:52Z,2022-07-13T17:53:28Z,2022-07-13T17:53:28Z,1,,1.96,2,220,Merged
Introduce colored output format for snapshot diffs in integration tests,2022-07-13T22:44:10Z,2022-08-11T16:06:18Z,2022-08-11T16:06:18Z,1,,689.3688888888889,3,136,Merged
fix content based message deduplication with sqs fifo queues,2022-07-15T00:34:28Z,2022-07-15T11:29:47Z,2022-07-15T11:29:47Z,1,,10.921944444444444,2,240,Merged
fix integration tests against pro,2022-07-15T09:32:36Z,2022-07-15T13:49:11Z,2022-07-15T13:49:11Z,1,,4.276388888888889,1,838,Merged
fix CLA allowlist (renamve renovate-bot to renovate),2022-07-18T07:28:20Z,2022-07-18T09:49:57Z,2022-07-18T09:49:57Z,1,,2.3602777777777777,1,315,Merged
"Fix volume dir path replacement for windows paths, use docker cmd client if not in docker",2022-07-18T11:47:11Z,2022-07-18T16:36:13Z,2022-07-18T16:36:13Z,1,,4.817222222222222,3,751,Merged
feat: add aws s3 latest region support,2022-07-18T13:17:40Z,,2022-07-19T01:36:48Z,2,,12.318888888888889,1,189,Closed
fix: print conserved docker logs if container is not running,2022-07-18T15:15:49Z,2022-07-21T14:35:03Z,2022-07-21T14:35:03Z,2,,71.32055555555556,1,58,Merged
add ec2 vpc terraform test cases,2022-07-18T16:51:33Z,2022-07-18T22:19:05Z,2022-07-18T22:19:05Z,1,,5.458888888888889,1,34,Merged
Changing ACM certificate fixture to handle regions as input parameters.,2022-07-19T09:48:01Z,2022-07-20T21:38:53Z,2022-07-20T21:38:53Z,1,,35.84777777777778,1,225,Merged
"Canonicalize Lambda policy name, initialize service provider in run_lambda(..)",2022-07-19T18:45:36Z,2022-07-20T10:47:43Z,2022-07-20T10:47:43Z,1,,16.03527777777778,4,730,Merged
"Remove API_REGIONS cache, replace with in-memory lookup",2022-07-19T20:23:00Z,2022-07-19T22:04:36Z,2022-07-19T22:04:36Z,1,,1.6933333333333334,4,196,Merged
CFN support for Iam Access key model,2022-07-19T21:22:23Z,2022-09-05T14:45:20Z,2022-09-05T14:45:20Z,7,,1145.3825,4,31,Merged
Utility to restart Docker containers,2022-07-20T08:33:57Z,2022-07-27T10:18:33Z,2022-07-27T10:18:33Z,1,,169.74333333333334,4,65,Merged
Moving zip utilities,2022-07-20T13:03:55Z,2022-07-20T19:01:14Z,2022-07-20T19:01:14Z,4,,5.955277777777778,2,196,Merged
added cloudwatch enable/disable actions,2022-07-20T16:01:31Z,2022-07-28T10:24:39Z,2022-07-28T10:24:39Z,2,,186.38555555555556,6,232,Merged
fix ASF / botocore CBOR decoding,2022-07-21T11:14:29Z,2022-07-21T16:00:40Z,2022-07-21T16:00:40Z,1,,4.769722222222223,3,438,Merged
Upgrade JAR files to resolve some recent security vulnerabilities,2022-07-21T15:36:11Z,2022-07-23T10:17:20Z,2022-07-23T10:17:20Z,3,,42.685833333333335,3,1067,Merged
